arxiv_id,title,publicationDate,year,citationCount,terms
2103.15545,Drop the GAN: In Defense of Patches Nearest Neighbors as Single Image Generative Models,2021-03-29,2021,75,european union
1802.03065,Generating Realistic Geology Conditioned on Physical Measurements with Generative Adversarial Networks,2018-02-08,2018,75,geology
2007.04774,Automated Chest CT Image Segmentation of COVID-19 Lung Infection based on 3D U-Net,2020-06-24,2020,75,coronavirus disease 2019 (covid-19)
2005.00832,"Flying Car Transportation System: Advances, Techniques, and Challenges",2020-04-26,2020,75,ethical issues
2402.09579,Advancing Building Energy Modeling with Large Language Models: Exploration and Case Studies,2024-02-14,2024,75,multidisciplinary approach
2009.05791,"COVID-19 what have we learned? The rise of social machines and connected devices in pandemic management following the concepts of predictive, preventive and personalized medicine",2020-07-30,2020,75,digital health
1801.02621,An Energy Conserving Routing Scheme for Wireless Body Sensor Nanonetwork Communication,2018-01-07,2018,75,nanotechnology
1409.5040,Communities and hierarchical structures in dynamic social networks: analysis and visualization,2011-04-01,2011,74,sociology
2407.01725,DiscoveryBench: Towards Data-Driven Discovery with Large Language Models,2024-07-01,2024,74,sociology
2009.02098,Explainable Artificial Intelligence for Process Mining: A General Overview and Application of a Novel Local Explanation Approach for Predictive Process Monitoring,2020-09-04,2020,74,process management
1905.08188,A Bayesian Approach to Robust Reinforcement Learning,2019-05-20,2019,74,adversarial system
2011.05369,Predicting Water Temperature Dynamics of Unmonitored Lakes With Meta‐Transfer Learning,2020-11-10,2020,74,environmental science
2109.06974,Algorithmic Auditing and Social Justice: Lessons from the History of Audit Studies,2021-09-14,2021,74,sociotechnical system
2501.12557,Understanding the LLM-ification of CHI: Unpacking the Impact of LLMs at CHI through a Systematic Literature Review,2025-01-22,2025,74,sociotechnical system
1707.09740,Statistical modeling of propagation channels for Terahertz band,2017-07-31,2017,74,telecommunications
2104.11943,"Is research with qualitative data more prevalent and impactful now? Interviews, case studies, focus groups and ethnographies",2021-04-24,2021,74,qualitative research
2010.01362,COVID-19 classification of X-ray images using deep neural networks,2020-10-03,2020,74,coronavirus disease 2019 (covid-19)
2210.05677,Application of Deep Learning on Single-cell RNA Sequencing Data Analysis: A Review,2022-10-01,2022,74,coronavirus disease 2019 (covid-19)
2210.17218,"Artificial intelligence in government: Concepts, standards, and a unified framework",2022-10-31,2022,73,political science; public administration
1805.09380,Anonymizing k-Facial Attributes via Adversarial Perturbations,2018-05-23,2018,73,world wide web
2109.00520,The Role of Explainability in Assuring Safety of Machine Learning in Healthcare,2021-09-01,2021,73,clinical decision support system; machine learning in healthcare
1404.1982,Aspect-Based Opinion Extraction from Customer reviews,2014-04-04,2014,73,natural language processing techniques
1308.4635,Realistic noise-tolerant randomness amplification using finite number of devices,2013-08-21,2013,73,philosophy of science
1111.0434,Pancake Flipping Is Hard,2011-11-02,2011,73,computational biology
2108.11875,A spatio-temporal LSTM model to forecast across multiple temporal and spatial scales,2021-08-26,2021,73,environmental science
2005.07661,"A model for COVID-19 with isolation, quarantine and testing as control measures",2020-05-15,2020,73,coronavirus disease 2019 (covid-19)
2010.08056,IoT Platform for COVID-19 Prevention and Control: A Survey,2020-10-15,2020,73,coronavirus disease 2019 (covid-19)
1810.07776,A Periodicity-based Parallel Time Series Prediction Algorithm in Cloud Computing Environments,2018-10-17,2018,73,real-time computing
2312.04233,Fine-tuning vision foundation model for crack segmentation in civil infrastructures,2023-12-07,2023,73,civil engineering
2311.09227,"Open-Sourcing Highly Capable Foundation Models: An evaluation of risks, benefits, and alternative methods for pursuing open-source objectives",2023-09-29,2023,73,unintended consequences
2004.10546,Inferring Degrees from Incomplete Networks and Nonlinear Dynamics,2020-04-21,2020,72,world wide web
1205.1960,A note on the PageRank of undirected graphs,2012-05-09,2012,72,world wide web
1901.03136,Automating the search for a patent’s prior art with a full text similarity search,2019-01-10,2019,72,natural language processing techniques
1604.04896,"Funding Data from Publication Acknowledgments: Coverage, Uses, and Limitations",2016-04-17,2016,72,medline
2402.17810,BioT5+: Towards Generalized Biological Understanding with IUPAC Integration and Multi-task Tuning,2024-02-27,2024,72,computational biology
2101.10895,A Primal-Dual Approach to Constrained Markov Decision Processes,2021-01-26,2021,72,operations management
2309.04142,Trustworthy and Synergistic Artificial Intelligence for Software Engineering: Vision and Roadmaps,2023-05-14,2023,72,software engineering research
2404.13207,STaRK: Benchmarking LLM Retrieval on Textual and Relational Knowledge Bases,2024-04-19,2024,72,precision medicine
2304.06678,Position Paper From the Digital Twins in Healthcare to the Virtual Human Twin: A Moon-Shot Project for Digital Health Research,2023-03-27,2023,72,digital health
2012.05893,Flatland-RL : Multi-Agent Reinforcement Learning on Trains,2020-12-10,2020,72,operations research
2308.16374,Accused: How students respond to allegations of using ChatGPT on assessments,2023-07-03,2023,72,thematic analysis
1507.02994,Networks of digital humanities scholars: The informational and social uses and gratifications of Twitter,2015-01-01,2015,72,thematic analysis
1502.06498,Accurate algorithms for identifying the median ranking when dealing with weak and partial rankings under the Kemeny axiomatic approach,2015-02-23,2015,71,political science
1605.05419,An Introduction to Programming for Bioscientists: A Python-Based Primer,2016-05-18,2016,71,computational biology
1607.05994,Dynamic Time Warping and Geometric Edit Distance,2016-07-20,2016,71,computational biology
2003.03623,Knowledge Graphs and Knowledge Networks: The Story in Brief,2019-07-01,2019,71,computational biology
2204.00883,Electricity Price Forecasting: The Dawn of Machine Learning,2022-04-02,2022,71,electrical engineering
2103.06228,Relaxing restrictions at the pace of vaccination increases freedom and guards against further COVID-19 waves,2021-03-10,2021,71,european union
2108.12112,TARGETING UNDERREPRESENTED POPULATIONS IN PRECISION MEDICINE: A FEDERATED TRANSFER LEARNING APPROACH,2021-08-27,2021,71,precision medicine
2005.01577,COVID-DA: Deep Domain Adaptation from Typical Pneumonia to COVID-19,2020-04-30,2020,71,coronavirus disease 2019 (covid-19)
1008.3311,Fault tolerant reversible logic synthesis: Carry look-ahead and carry-skip adders,2009-07-15,2009,71,nanotechnology
1501.05151,Recursive Bayesian filtering in circular state spaces,2015-01-21,2015,71,aeronautics
2306.01771,ProcessGPT: Transforming Business Process Management with Generative Artificial Intelligence,2023-05-29,2023,70,process management
2111.08441,Use of machine learning in geriatric clinical care for chronic diseases: a systematic literature review,2020-10-01,2020,70,medline
1907.03037,Near-optimal fully dynamic densest subgraph,2019-07-05,2019,70,computational biology
1109.3437,Learning Topic Models by Belief Propagation,2011-09-15,2011,70,computational biology
1712.02975,Recruitment Market Trend Analysis with Sequential Latent Variable Models,2016-08-13,2016,70,economic growth
2103.11316,Automated Software Vulnerability Assessment with Concept Drift,2019-05-01,2019,70,software engineering research
2402.18225,CogBench: a large language model walks into a psychology lab,2024-02-28,2024,70,cognitive psychology
1812.09139,Technical Proposal for FASER: ForwArd Search ExpeRiment at the LHC,2018-12-21,2018,70,civil engineering
2207.13799,"Network polarization, filter bubbles, and echo chambers: an annotated review of measures and reduction methods",2022-07-27,2022,69,political science
1305.6078,Degree distribution in quantum walks on complex networks,2013-05-27,2013,69,sociology
1205.2648,Learning Continuous-Time Social Network Dynamics,2009-06-18,2009,69,sociology
1709.03628,The Internet-of-Things Meets Business Process Management: Mutual Benefits and Challenges,2017-09-11,2017,69,process management
1203.1569,SPARQL for a Web of Linked Data: Semantics and Computability (Extended Version),2012-03-07,2012,69,world wide web
1710.04324,Explaining Trained Neural Networks with Semantic Web Technologies: First Steps,2017-10-11,2017,69,world wide web
1803.08812,Paving the way for culturally competent robots: A position paper,2017-08-01,2017,69,nursing
2101.08904,Applications of artificial intelligence in drug development using real-world data,2020-12-22,2020,69,applications of artificial intelligence
1904.13342,PYRO-NN: Python Reconstruction Operators in Neural Networks,2019-04-30,2019,69,medical physics
2007.00514,Regularized Online Allocation Problems: Fairness and Beyond,2020-07-01,2020,69,operations management
2204.01632,Semantic similarity metrics for evaluating source code summarization,2022-04-04,2022,69,software engineering research
1909.08664,Corruption risk in contracting markets: a network science perspective,2019-09-18,2019,69,european union
2205.10095,How to keep text private? A systematic review of deep learning methods for privacy-preserving natural language processing,2022-05-20,2022,69,european union
2505.14715,"A Comprehensive Review of Techniques, Algorithms, Advancements, Challenges, and Clinical Applications of Multi-modal Medical Image Fusion for Improved Diagnosis",2025-05-18,2025,69,precision medicine
2005.12679,Design of a Low-Cost Miniature Robot to Assist the COVID-19 Nasopharyngeal Swab Sampling,2020-05-26,2020,69,coronavirus disease 2019 (covid-19)
2104.03225,Dual-Consistency Semi-Supervised Learning with Uncertainty Quantification for COVID-19 Lesion Segmentation from CT Images,2021-04-07,2021,69,coronavirus disease 2019 (covid-19)
1812.08335,Towards Value-Sensitive Learning Analytics Design,2018-12-20,2018,69,ethical issues
2310.10995,Inverse design of a pyrochlore lattice of DNA origami through model-driven experiments,2023-10-17,2023,69,nanotechnology
1211.5820,A bird's-eye view of scientific trading: Dependency relations among fields of science,2012-11-25,2012,68,nursing; sociology
1509.04037,Measuring Partial Balance in Signed Networks,2015-09-14,2015,68,sociology
2403.07541,Process Modeling With Large Language Models,2024-03-12,2024,68,process management
1003.5455,Towards physical laws for software architecture,2010-03-29,2010,68,world wide web
1802.10568,Machine learning and genomics: precision medicine versus patient privacy,2018-02-28,2018,68,computational biology; precision medicine
2011.13185,Determination of egg storage time at room temperature using a low-cost NIR spectrometer and machine learning techniques,2018-02-01,2018,68,european union
2311.03999,Human-AI Collaboration in Thematic Analysis using ChatGPT: A User Study and Design Recommendations,2023-11-07,2023,68,qualitative research; thematic analysis
cs/0609023,Novel Reversible `TSG' Gate and Its Application for Designing Components of Primitive Reversible/Quantum ALU,2005-12-06,2005,68,nanotechnology
1804.05146,A comparison of methods for model selection when estimating individual treatment effects,2018-04-14,2018,67,political science
2303.17555,Factoring the Matrix of Domination: A Critical Review and Reimagination of Intersectionality in AI Fairness,2023-03-16,2023,67,epistemology
1712.04407,Logo Synthesis and Manipulation with Clustered Generative Adversarial Networks,2017-12-12,2017,67,world wide web
cs/0503068,A Survey of Reverse Engineering and Program Comprehension,2005-03-24,2005,67,world wide web
2101.11218,What We Can Learn From Visual Artists About Software Development,2021-01-27,2021,67,systems engineering
2310.17894,Natural Language Interfaces for Tabular Data Querying and Visualization: A Survey,2023-10-27,2023,67,natural language processing techniques
cs/0504036,Scientific impact quantity and quality: Analysis of two sources of bibliographic data,2005-04-11,2005,67,philosophy of science
1905.06396,Machine Learning-Based Delay-Aware UAV Detection and Operation Mode Identification Over Encrypted Wi-Fi Traffic,2019-05-15,2019,67,economic growth
2103.16484,Detecting informative higher-order interactions in statistically validated hypergraphs,2021-03-30,2021,67,sociotechnical system
1212.0823,Interdisciplinarity at the journal and specialty level: The changing knowledge bases of the journal cognitive science,2012-12-04,2012,67,cognitive psychology
2207.05691,"The MuSe 2022 Multimodal Sentiment Analysis Challenge: Humor, Emotional Reactions, and Stress",2022-06-23,2022,67,health informatics
2309.17447,A Large Language Model Approach to Educational Survey Feedback Analysis,2023-09-29,2023,67,thematic analysis
2006.02666,Deep Sequential Feature Learning in Clinical Image Classification of Infectious Keratitis,2020-06-04,2020,67,medical emergency
1810.12666,The combined effects of age and seniority on research performance of full professors,2016-06-01,2016,67,civil engineering
2312.10904,Dynamic Retrieval Augmented Generation of Ontologies using Artificial Intelligence (DRAGON-AI),2023-12-18,2023,67,food science
2008.12372,Data-driven Computational Social Science: A Survey,2020-08-10,2020,66,political science; sociology
1706.07257,A survey of Hardware-based Control Flow Integrity (CFI),2017-06-22,2017,66,computer security
2306.02444,"Energy-Sustainable IoT Connectivity: Vision, Technological Enablers, Challenges, and Future Directions",2023-06-04,2023,66,economic growth
2305.16088,Social Sustainability of Digital Transformation: Empirical Evidence from EU-27 Countries,2023-05-08,2023,66,economic growth
2406.07737,The Future of AI-Driven Software Engineering,2024-06-11,2024,66,software engineering research
2003.10006,Rapid Reviews in Software Engineering,2020-03-22,2020,66,software engineering research
1811.05422,Bayesian Data Analysis in Empirical Software Engineering Research,2018-11-13,2018,66,software engineering research
1309.0728,"Eavesdropping time and frequency: phase noise cancellation along a time-varying path, such as an optical fiber.",2013-09-03,2013,66,telecommunications
2210.04541,A Systematic Literature Review of the Tension between the GDPR and Public Blockchain Systems,2022-10-10,2022,66,european union
2105.01434,Towards Accountability in the Use of Artificial Intelligence for Public Administrations,2021-05-04,2021,66,public administration
2302.03284,Unsupervised Deep Learning for IoT Time Series,2023-02-07,2023,66,health informatics
2210.11695,Global Counterfactual Explainer for Graph Neural Networks,2022-10-21,2022,65,computational biology; computer security
1211.4683,Content based video retrieval,2012-10-31,2012,65,world wide web
2308.04709,"A Comparative Study of Open-Source Large Language Models, GPT-4 and Claude 2: Multiple-Choice Test Taking in Nephrology",2023-08-09,2023,65,internal medicine
2306.11078,Beyond Normal: On the Evaluation of Mutual Information Estimators,2023-06-19,2023,65,computational biology
0807.4071,FORECASTING TIME SERIES OF INHOMOGENEOUS POISSON PROCESSES WITH APPLICATION TO CALL CENTER WORKFORCE MANAGEMENT,2008-06-01,2008,65,operations management
2103.10201,The impact of using biased performance metrics on software defect prediction research,2021-03-18,2021,65,software engineering research
2107.13360,Quantum technologies in the telecommunications industry,2021-07-22,2021,65,telecommunications
2003.07703,Flexible and Context-Specific AI Explainability: A Multidisciplinary Approach,2020-03-12,2020,65,multidisciplinary approach
1911.11204,Energy-efficient stochastic computing with superparamagnetic tunnel junctions,2019-11-25,2019,65,nanotechnology
1411.5204,Measuring Urban Deprivation from User Generated Content,2014-11-19,2014,65,thematic analysis
2403.15586,"Generative AI in Education: A Study of Educators' Awareness, Sentiments, and Influencing Factors",2024-03-22,2024,65,thematic analysis
2302.14326,Ethical Frameworks and Computer Security Trolley Problems: Foundations for Conversations,2023-02-28,2023,64,computer security
0912.1961,Networked buffering: a basic mechanism for distributed robustness in complex adaptive systems,2009-12-10,2009,64,systems engineering
1706.00933,Evolution of statistical analysis in empirical software engineering research: Current state and steps forward,2017-06-03,2017,64,software engineering research
2205.05046,Broadband physical layer cognitive radio with an integrated photonic processor for blind source separation,2022-05-07,2022,64,telecommunications
1903.01517,A bibliometric analysis of publications in computer networking research,2019-03-04,2019,64,electrical engineering
2301.12687,Understanding Visual Arts Experiences of Blind People,2023-01-30,2023,64,visual arts
1610.09045,Machine Learning Model Interpretability for Precision Medicine,2016-10-28,2016,64,precision medicine
1310.7965,"Smartphone as a Personal, Pervasive Health Informatics Services Platform: Literature Review",2012-08-01,2012,64,health informatics
1910.06291,The Materials Simulation Toolkit for Machine learning (MAST-ML): An automated open source toolkit to accelerate data-driven materials research,2019-10-14,2019,64,machine learning in materials science
2305.10369,Sustainability in Computing Education: A Systematic Literature Review,2023-05-17,2023,64,thematic analysis
2307.13912,Embedding Democratic Values into Social Media AIs via Societal Objective Functions,2023-07-26,2023,63,political science
1609.04495,Tsallis Regularized Optimal Transport and Ecological Inference,2016-09-15,2016,63,political science
1604.00777,Categories: How I Learned to Stop Worrying and Love Two Sorts,2016-04-04,2016,63,management science
2304.04309,Large Language Models for Business Process Management: Opportunities and Challenges,2023-04-09,2023,63,process management
2206.11684,Theory-Grounded Measurement of U.S. Social Stereotypes in English Language Models,2022-06-23,2022,63,social psychology
2009.09210,A framework for effective corporate communication after cyber security incidents,2020-09-19,2020,63,public relations
0711.3128,Entity ranking in Wikipedia,2007-11-20,2007,63,natural language processing techniques
1707.00838,Worse Than Spam: Issues In Sampling Software Developers,2016-09-08,2016,63,ethical issues; software engineering research
1505.07240,"How do you feel, developer? An explanatory theory of the impact of affects on programming performance",2015-05-27,2015,63,software engineering research
1503.02515,Quantum Information Biology: From Information Interpretation of Quantum Mechanics to Applications in Molecular Biology and Cognitive Psychology,2015-03-09,2015,63,cognitive psychology
1708.09619,The UTMOST: A Hybrid Digital Signal Processor Transforms the Molonglo Observatory Synthesis Telescope,2017-08-31,2017,63,telecommunications
2203.08933,The Digital Divide in Canada and the Role of LEO Satellites in Bridging the Gap,2022-03-16,2022,63,telecommunications
1711.08149,Accurate real time localization tracking in a clinical environment using Bluetooth Low Energy and deep learning,2017-11-22,2017,63,patient safety
1612.03608,A one-way ANOVA test for functional data with graphical interpretation,2016-12-12,2016,63,european union
1802.04480,RoboChain: A Secure Data-Sharing Framework for Human-Robot Interaction,2018-02-13,2018,63,european union
2401.12249,Understanding users' negative emotions and continuous usage intention in short video platforms,2023-02-01,2023,63,qualitative research
1911.07125,Opportunities for Artificial Intelligence in Advancing Precision Medicine,2019-11-17,2019,63,digital health; precision medicine
2004.12592,Robust Screening of COVID-19 from Chest X-ray via Discriminative Cost-Sensitive Learning,2020-04-27,2020,63,coronavirus disease 2019 (covid-19)
2106.02225,Materials Representation and Transfer Learning for Multi-Property Prediction,2021-05-24,2021,63,machine learning in materials science
1306.1264,The Chills and Thrills of Whole Genome Sequencing,2013-06-05,2013,63,ethical issues
2406.07571,Supporting Self-Reflection at Scale with Large Language Models: Insights from Randomized Field Experiments in Classrooms,2024-06-01,2024,63,thematic analysis
1705.07325,Fast Change Point Detection on Dynamic Social Networks,2017-05-20,2017,62,political science; sociology
2402.11814,An Empirical Evaluation of LLMs for Solving Offensive Security Challenges,2024-02-19,2024,62,computer security
2410.02683,DailyDilemmas: Revealing Value Preferences of LLMs with Quandaries of Daily Life,2024-10-03,2024,62,sociology
1309.2199,Distinguishing topical and social groups based on common identity and bond theory,2013-02-04,2013,62,sociology
1411.7460,Fast Algorithms for the Maximum Clique Problem on Massive Graphs with Applications to Overlapping Community Detection,2014-11-26,2014,62,world wide web
0908.2300,Latent Markov model for longitudinal binary data: An application to the performance evaluation of nursing homes,2009-06-01,2009,62,nursing
1808.03296,Do females create higher impact research? Scopus citations and Mendeley readers for articles from five countries,2018-08-09,2018,62,nursing
1707.01861,A robust interrupted time series model for analyzing complex health care intervention data,2017-07-06,2017,62,nursing
2010.07627,Design Ontology Supporting Model-Based Systems Engineering Formalisms,2020-10-15,2020,62,systems engineering
2402.10977,Generative AI and Process Systems Engineering: The Next Frontier,2024-02-15,2024,62,systems engineering
1009.0881,A multilevel approach for nonnegative matrix factorization,2010-09-04,2010,62,computational biology
2402.04286,Progress and opportunities of foundation models in bioinformatics,2024-02-06,2024,62,computational biology
1602.04181,Spectral Alignment of Graphs,2016-02-12,2016,62,computational biology
2501.00383,Proactive Conversational Agents with Inner Thoughts,2024-12-31,2024,62,cognitive psychology
1901.00971,Evolution of Physical-Layer Communications Research in the Post-5G Era,2019-01-04,2019,62,telecommunications
2210.13448,EUR-Lex-Sum: A Multi- and Cross-lingual Dataset for Long-form Summarization in the Legal Domain,2022-10-24,2022,62,european union
2410.07362,"Large Language Models in Qualitative Research: Uses, Tensions, and Intentions",2024-10-09,2024,62,qualitative research
2103.01006,GaNDLF: the generally nuanced deep learning framework for scalable end-to-end clinical workflows,2021-02-26,2021,62,precision medicine
2209.09803,Spillover of Antisocial Behavior from Fringe Platforms: The Unintended Consequences of Community Banning,2022-09-20,2022,62,unintended consequences
1604.03632,"Strategyproof peer selection using randomization, partitioning, and apportionment",2016-04-13,2016,61,political science
0905.1738,Information ranking and power laws on trees,2009-05-11,2009,61,world wide web
2003.10421,Multimodal Analytics for Real-world News using Measures of Cross-modal Entity Consistency,2020-03-23,2020,61,world wide web
2112.10609,An ensemble deep learning technique for detecting suicidal ideation from posts in social media platforms,2021-11-01,2021,61,natural language processing techniques
1912.06761,Targeted transfer learning to improve performance in small medical physics datasets.,2019-12-14,2019,61,medical physics
2005.04988,A review of radar-based nowcasting of precipitation and applicable machine learning techniques,2020-05-11,2020,61,environmental science
2212.08198,Economic impacts of AI-augmented R&D,2022-12-15,2022,61,economic growth
1507.04587,Lessons learned from applying social network analysis on an industrial Free/Libre/Open Source Software ecosystem,2015-07-04,2015,61,software engineering research
2303.11436,Mind meets machine: Unravelling GPT-4's cognitive psychology,2023-03-20,2023,61,cognitive psychology
2105.05993,The flare likelihood and region eruption forecasting (FLARECAST) project: flare forecasting in the big data & machine learning era,2021-05-12,2021,61,european union
1907.07498,"The General Data Protection Regulation: Requirements, Architectures, and Constraints",2019-07-17,2019,61,european union
2405.13041,Assessing political bias in large language models,2024-05-17,2024,61,european union
2205.02948,High-Dimensional Survival Analysis: Methods and Applications,2022-05-05,2022,61,precision medicine
1704.05960,SAFS: A deep feature selection approach for precision medicine,2016-12-01,2016,61,precision medicine
2004.10899,What are We Depressed about When We Talk about COVID19: Mental Health Analysis on Tweets Using Natural Language Processing,2020-04-22,2020,61,coronavirus disease 2019 (covid-19)
2108.10761,Federated Learning for Privacy-Preserving Open Innovation Future on Digital Health,2021-08-24,2021,61,digital health
0806.1385,Control-Scheduling Codesign: A Perspective on Integrating Control and Computing,2008-06-09,2008,61,real-time computing
2008.05204,Pixel-level Corrosion Detection on Metal Constructions by Fusion of Deep Learning Semantic and Contour Segmentation,2020-08-12,2020,61,civil engineering
2304.12600,Application of segment anything model for civil infrastructure defect assessment,2023-04-25,2023,61,civil engineering
1407.2143,Parameterized Algorithmics for Computational Social Choice: Nine Research Challenges,2014-07-08,2014,60,political science
