arxiv_id,title,publicationDate,year,citationCount,terms
1706.03762,Attention is All you Need,2017-06-12,2017,185138,architecture
1412.6980,Adam: A Method for Stochastic Optimization,2014-12-22,2014,168623,algorithm
1810.04805,BERT: Pre-training of Deep Bidirectional Transformers for Language Understanding,,2019,117890,architecture; natural language processing
1409.1556,Very Deep Convolutional Networks for Large-Scale Image Recognition,2014-09-04,2014,112845,architecture; computer vision
1505.04597,U-Net: Convolutional Networks for Biomedical Image Segmentation,2015-05-18,2015,98542,architecture; implementation
1201.0490,Scikit-learn: Machine Learning in Python,2011-02-01,2011,91598,algorithm; documentation; machine learning
1506.01497,Faster R-CNN: Towards Real-Time Object Detection with Region Proposal Networks,2015-06-04,2015,74124,algorithm
2010.11929,An Image is Worth 16x16 Words: Transformers for Image Recognition at Scale,2020-10-22,2020,66375,architecture; computer vision; natural language processing
2005.14165,Language Models are Few-Shot Learners,2020-05-28,2020,60873,architecture
1603.02754,XGBoost: A Scalable Tree Boosting System,2016-03-09,2016,57503,algorithm; machine learning
1912.01703,"PyTorch: An Imperative Style, High-Performance Deep Learning Library",2019-12-03,2019,53819,architecture; deep learning; implementation; machine learning; usability
2103.00020,Learning Transferable Visual Models From Natural Language Supervision,2021-02-26,2021,52446,benchmarking; computer vision; usability
1409.4842,Going deeper with convolutions,2014-09-16,2014,47623,architecture
1502.03167,Batch Normalization: Accelerating Deep Network Training by Reducing Internal Covariate Shift,2015-02-10,2015,47237,architecture
1506.02640,"You Only Look Once: Unified, Real-Time Object Detection",2015-06-08,2015,46798,architecture
1608.06993,Densely Connected Convolutional Networks,2016-08-25,2016,44004,architecture
1409.0575,ImageNet Large Scale Visual Recognition Challenge,2014-09-01,2014,43102,computer vision
1411.4038,Fully convolutional networks for semantic segmentation,2014-11-14,2014,42391,architecture
1705.07874,A Unified Approach to Interpreting Model Predictions,2017-05-22,2017,37748,deep learning; interpretability
1609.02907,Semi-Supervised Classification with Graph Convolutional Networks,2016-09-09,2016,36050,architecture
1709.01507,Squeeze-and-Excitation Networks,2017-09-05,2017,35164,architecture
1301.3781,Efficient Estimation of Word Representations in Vector Space,2013-01-16,2013,34675,architecture
2103.14030,Swin Transformer: Hierarchical Vision Transformer using Shifted Windows,,2021,33907,architecture; computer vision
2006.11239,Denoising Diffusion Probabilistic Models,2020-06-19,2020,33099,implementation
1512.00567,Rethinking the Inception Architecture for Computer Vision,2015-12-02,2015,31425,architecture; big data; computer vision
2203.00667,Generative Adversarial Networks,2021-08-31,2021,30461,architecture; deep learning
1409.0473,Neural Machine Translation by Jointly Learning to Align and Translate,2014-09-01,2014,29713,architecture
1707.06347,Proximal Policy Optimization Algorithms,2017-07-20,2017,29411,algorithm; reinforcement learning; robot
1311.2524,Rich Feature Hierarchies for Accurate Object Detection and Semantic Segmentation,2013-11-11,2013,29223,algorithm
1610.02391,Grad-CAM: Visual Explanations from Deep Networks via Gradient-Based Localization,2016-10-07,2016,28133,architecture; computer vision; reinforcement learning
1612.03144,Feature Pyramid Networks for Object Detection,2016-12-09,2016,27455,architecture
1710.10903,Graph Attention Networks,2017-10-30,2017,27221,architecture
1910.10683,Exploring the Limits of Transfer Learning with a Unified Text-to-Text Transformer,2019-10-23,2019,26574,architecture; natural language processing
2112.10752,High-Resolution Image Synthesis with Latent Diffusion Models,2021-12-20,2021,26203,architecture
0906.2569,QUANTUM ESPRESSO: a modular and open-source software project for quantum simulations of materials,2009-06-14,2009,25858,algorithm; architecture; software
1602.05629,Communication-Efficient Learning of Deep Networks from Decentralized Data,2016-02-17,2016,25666,architecture
1704.04861,MobileNets: Efficient Convolutional Neural Networks for Mobile Vision Applications,2017-04-17,2017,25476,architecture
2002.05709,A Simple Framework for Contrastive Learning of Visual Representations,2020-02-13,2020,25268,algorithm; architecture
1801.04381,MobileNetV2: Inverted Residuals and Linear Bottlenecks,2018-01-13,2018,25159,architecture
1905.11946,EfficientNet: Rethinking Model Scaling for Convolutional Neural Networks,2019-05-24,2019,25127,architecture
1503.02531,Distilling the Knowledge in a Neural Network,2015-03-09,2015,25126,algorithm; machine learning
1807.06521,CBAM: Convolutional Block Attention Module,2018-07-17,2018,24550,architecture
1210.0736,Quantum Computation and Quantum Information,2012-08-01,2012,23665,algorithm; computer science; mathematics; physics; statistics
1305.3347,featureCounts: an efficient general purpose program for assigning sequence reads to genomic features,2013-05-15,2013,23406,implementation; software
1611.07004,Image-to-Image Translation with Conditional Adversarial Networks,2016-11-21,2016,22692,software
1412.6572,Explaining and Harnessing Adversarial Examples,2014-12-19,2014,22640,architecture; machine learning
2203.02155,Training language models to follow instructions with human feedback,2022-03-04,2022,22583,reinforcement learning
1606.00915,"DeepLab: Semantic Image Segmentation with Deep Convolutional Nets, Atrous Convolution, and Fully Connected CRFs",2016-06-02,2016,21257,deep learning
2006.10256,Array programming with NumPy,2020-06-18,2020,21228,biology; chemistry; economics; finance; interoperability; materials science; physics; psychology; software
2106.09685,LoRA: Low-Rank Adaptation of Large Language Models,2021-06-17,2021,21072,architecture; implementation; natural language processing
1502.01852,Delving Deep into Rectifiers: Surpassing Human-Level Performance on ImageNet Classification,2015-02-06,2015,20722,architecture
1706.02216,Inductive Representation Learning on Large Graphs,2017-06-07,2017,20359,algorithm
0803.0476,Fast unfolding of communities in large networks,2008-03-04,2008,20215,algorithm
1605.08695,TensorFlow: A system for large-scale machine learning,2016-05-27,2016,19830,algorithm; architecture; machine learning; management
2005.12872,End-to-End Object Detection with Transformers,2020-05-26,2020,19073,architecture
1801.03924,The Unreasonable Effectiveness of Deep Features as a Perceptual Metric,2018-01-11,2018,18709,architecture; deep learning; perception
1511.00561,SegNet: A Deep Convolutional Encoder-Decoder Architecture for Image Segmentation,2015-11-02,2015,18181,architecture; implementation
1610.02357,Xception: Deep Learning with Depthwise Separable Convolutions,2016-10-07,2016,18098,architecture; deep learning
1612.00593,PointNet: Deep Learning on Point Sets for 3D Classification and Segmentation,2016-12-02,2016,18001,architecture; deep learning
1404.7828,Deep learning in neural networks: An overview,2014-04-30,2014,17623,artificial neural network; deep learning; history; machine learning; reinforcement learning
1311.2901,Visualizing and Understanding Convolutional Networks,2013-11-12,2013,17216,architecture
1802.02611,Encoder-Decoder with Atrous Separable Convolution for Semantic Image Segmentation,2018-02-07,2018,17131,implementation
2407.21783,The Llama 3 Herd of Models,2024-07-31,2024,17020,artificial intelligence
1312.6114,Auto-Encoding Variational Bayes,2013-12-20,2013,16819,algorithm
2005.11401,Retrieval-Augmented Generation for Knowledge-Intensive NLP Tasks,2020-05-22,2020,16018,architecture
1509.02971,Continuous control with deep reinforcement learning,2015-09-09,2015,15672,algorithm; architecture; physics; reinforcement learning
1602.07261,"Inception-v4, Inception-ResNet and the Impact of Residual Connections on Learning",2016-02-23,2016,15639,architecture
1511.06434,Unsupervised Representation Learning with Deep Convolutional Generative Adversarial Networks,2015-11-19,2015,15171,computer vision
1706.06083,Towards Deep Learning Models Resistant to Adversarial Attacks,2017-06-19,2017,15150,deep learning
1503.03832,FaceNet: A unified embedding for face recognition and clustering,2015-03-12,2015,15109,deep learning
1408.5093,Caffe: Convolutional Architecture for Fast Feature Embedding,2014-06-20,2014,14878,algorithm; architecture; deep learning; implementation; multimedia
1703.03400,Model-Agnostic Meta-Learning for Fast Adaptation of Deep Networks,2017-03-09,2017,14791,algorithm; reinforcement learning
2304.02643,Segment Anything,2023-04-05,2023,14594,computer vision
1706.02413,PointNet++: Deep Hierarchical Feature Learning on Point Sets in a Metric Space,2017-06-07,2017,14537,deep learning
1408.5882,Convolutional Neural Networks for Sentence Classification,2014-08-25,2014,14334,architecture
1206.5538,Representation Learning: A Review and New Perspectives,2012-06-24,2012,14054,algorithm; deep learning; machine learning
1807.03748,Representation Learning with Contrastive Predictive Coding,2018-07-10,2018,13884,artificial intelligence; reinforcement learning
1312.5602,Playing Atari with Deep Reinforcement Learning,2013-12-19,2013,13842,algorithm; architecture; deep learning; reinforcement learning
1702.05747,A survey on deep learning in medical image analysis,2017-02-19,2017,13825,algorithm; deep learning; pathology
1604.01685,The Cityscapes Dataset for Semantic Urban Scene Understanding,2016-04-06,2016,13793,deep learning
1812.04948,A Style-Based Generator Architecture for Generative Adversarial Networks,2018-12-12,2018,13245,architecture
1708.01492,Minimap2: pairwise alignment for nucleotide sequences,2017-08-04,2017,13051,algorithm; bioinformatics; database; implementation
1910.13461,"BART: Denoising Sequence-to-Sequence Pre-training for Natural Language Generation, Translation, and Comprehension",2019-10-29,2019,12990,architecture
1303.3997,"Aligning sequence reads, clone sequences and assembly contigs with BWA-MEM",2013-03-16,2013,12905,algorithm; implementation
1607.06450,Layer Normalization,2016-07-21,2016,12863,statistics
1802.03426,UMAP: Uniform Manifold Approximation and Projection for Dimension Reduction,2018-02-09,2018,12801,algorithm; machine learning
1406.4729,Spatial Pyramid Pooling in Deep Convolutional Networks for Visual Recognition,2014-06-18,2014,12656,architecture
2012.10295,Twelve years of SAMtools and BCFtools,2020-12-18,2020,12466,documentation; software; statistics
2105.05233,Diffusion Models Beat GANs on Image Synthesis,2021-05-11,2021,12456,architecture; generative model
1607.00653,node2vec: Scalable Feature Learning for Networks,2016-07-03,2016,12383,algorithm
physics/0602124,Modularity and community structure in networks.,2006-02-17,2006,12286,algorithm
1506.02142,Dropout as a Bayesian Approximation: Representing Model Uncertainty in Deep Learning,2015-06-06,2015,12271,architecture; deep learning; machine learning; reinforcement learning
2111.06377,Masked Autoencoders Are Scalable Vision Learners,2021-11-11,2021,12161,architecture; computer vision
1710.09412,mixup: Beyond Empirical Risk Minimization,2017-10-25,2017,12064,architecture
1603.04467,TensorFlow: Large-Scale Machine Learning on Heterogeneous Distributed Systems,2016-03-14,2016,11787,algorithm; computer science; computer vision; drug; drug discovery; implementation; machine learning; natural language processing; robot; robotics
1611.05431,Aggregated Residual Transformations for Deep Neural Networks,2016-11-16,2016,11778,architecture
1801.01290,Soft Actor-Critic: Off-Policy Maximum Entropy Deep Reinforcement Learning with a Stochastic Actor,2018-01-04,2018,11754,algorithm; reinforcement learning
1505.07818,Domain-Adversarial Training of Neural Networks,2015-05-28,2015,11743,architecture; deep learning
1411.1784,Conditional Generative Adversarial Nets,2014-11-06,2014,11722,generative model
1207.0203,"Internet of Things (IoT): A vision, architectural elements, and future directions",2012-07-01,2012,11642,distributed computing; implementation; internet of things
0906.0612,Community detection in graphs,2009-06-03,2009,11565,biology; computer science; sociology
1901.00596,A Comprehensive Survey on Graph Neural Networks,,2019,11523,algorithm; data mining; deep learning; machine learning
0711.0189,A tutorial on spectral clustering,2007-11-01,2007,11487,algorithm; software
2011.13456,Score-Based Generative Modeling through Stochastic Differential Equations,2020-11-26,2020,11458,generative model
1410.4803,Second-generation PLINK: rising to the challenge of larger and richer datasets,2014-10-17,2014,11320,algorithm; genetics; implementation
1603.05027,Identity Mappings in Deep Residual Networks,2016-03-16,2016,11273,architecture
1606.04797,V-Net: Fully Convolutional Neural Networks for Volumetric Medical Image Segmentation,2016-06-15,2016,11036,computer vision
1704.00028,Improved Training of Wasserstein GANs,2017-03-31,2017,11025,architecture; generative model
1708.07747,Fashion-MNIST: a Novel Image Dataset for Benchmarking Machine Learning Algorithms,2017-08-25,2017,10875,algorithm; benchmarking; machine learning
1607.04606,Enriching Word Vectors with Subword Information,2016-07-15,2016,10833,natural language processing
1403.6652,DeepWalk: online learning of social representations,2014-03-26,2014,10825,algorithm; deep learning
2207.02696,YOLOv7: Trainable Bag-of-Freebies Sets New State-of-the-Art for Real-Time Object Detectors,2022-07-06,2022,10717,architecture; computer vision
1907.10902,Optuna: A Next-generation Hyperparameter Optimization Framework,2019-07-25,2019,10635,architecture; distributed computing; implementation; software
2107.03374,Evaluating Large Language Models Trained on Code,2021-07-07,2021,10603,economics
1606.03498,Improved Techniques for Training GANs,2016-06-10,2016,10484,generative model
1503.03585,Deep Unsupervised Learning using Nonequilibrium Thermodynamics,2015-03-11,2015,10380,algorithm; generative model; implementation; machine learning; physics
1612.00796,Overcoming catastrophic forgetting in neural networks,2016-12-02,2016,10373,artificial intelligence; machine learning; neuroscience; reinforcement learning
1711.07971,Non-local Neural Networks,2017-11-21,2017,10277,computer vision
1510.00149,"Deep Compression: Compressing Deep Neural Network with Pruning, Trained Quantization and Huffman Coding",2015-10-01,2015,10217,embedded system
1602.01783,Asynchronous Methods for Deep Reinforcement Learning,2016-02-04,2016,10161,algorithm; reinforcement learning
1910.01108,"DistilBERT, a distilled version of BERT: smaller, faster, cheaper and lighter",2019-10-02,2019,10118,natural language processing
1706.05587,Rethinking Atrous Convolution for Semantic Image Segmentation,2017-06-17,2017,10053,implementation
1608.04644,Towards Evaluating the Robustness of Neural Networks,2016-08-16,2016,10038,algorithm; machine learning
1202.3665,emcee: The MCMC Hammer,2012-02-16,2012,10018,algorithm; implementation
2306.05685,Judging LLM-as-a-judge with MT-Bench and Chatbot Arena,2023-06-09,2023,9845,preference
0706.1062,Power-Law Distributions in Empirical Data,2007-06-07,2007,9833,law
1407.8038,"Estimating the sample mean and standard deviation from the sample size, median, range and/or interquartile range",2014-07-30,2014,9814,systematic review
1506.04214,Convolutional LSTM Network: A Machine Learning Approach for Precipitation Nowcasting,2015-06-13,2015,9801,algorithm; machine learning
1411.7766,Deep Learning Face Attributes in the Wild,2014-11-27,2014,9793,deep learning
1405.4053,Distributed Representations of Sentences and Documents,2014-05-16,2014,9769,algorithm; machine learning
1905.02244,Searching for MobileNetV3,2019-05-06,2019,9719,algorithm
2305.18290,Direct Preference Optimization: Your Language Model is Secretly a Reward Model,2023-05-29,2023,9673,algorithm; preference; reinforcement learning
1206.2944,Practical Bayesian Optimization of Machine Learning Algorithms,2012-06-13,2012,9577,algorithm; machine learning
1801.00862,Quantum Computing in the NISQ era and beyond,2018-01-02,2018,9498,physics
2308.04079,3D Gaussian Splatting for Real-Time Radiance Field Rendering,2023-07-26,2023,9412,algorithm
1501.00092,Image Super-Resolution Using Deep Convolutional Networks,2014-12-31,2014,9409,deep learning
2304.07193,DINOv2: Learning Robust Visual Features without Supervision,2023-04-14,2023,9340,computer vision; natural language processing
1509.06461,Deep Reinforcement Learning with Double Q-Learning,2015-09-22,2015,9239,algorithm; reinforcement learning
1704.01212,Neural Message Passing for Quantum Chemistry,2017-04-04,2017,9225,algorithm; chemistry; drug; drug discovery; materials science
1910.10045,"Explainable Artificial Intelligence (XAI): Concepts, Taxonomies, Opportunities and Challenges toward Responsible AI",2019-10-22,2019,9014,accountability; artificial intelligence; deep learning; explainable artificial intelligence (xai); implementation; interpretability; machine learning
1912.04977,Advances and Open Problems in Federated Learning,2019-12-10,2019,9003,data science; machine learning
2009.03300,Measuring Massive Multitask Language Understanding,2020-09-07,2020,8900,computer science; history; law; mathematics
2210.03629,ReAct: Synergizing Reasoning and Acting in Language Models,2022-10-06,2022,8871,interpretability; reinforcement learning
1508.07909,Neural Machine Translation of Rare Words with Subword Units,2015-08-31,2015,8851,algorithm
2105.15203,SegFormer: Simple and Efficient Design for Semantic Segmentation with Transformers,2021-05-31,2021,8794,perception
2006.07733,Bootstrap Your Own Latent: A New Approach to Self-Supervised Learning,2020-06-13,2020,8789,implementation
2201.03545,A ConvNet for the 2020s,2022-01-10,2022,8776,computer vision
1606.09375,Convolutional Neural Networks on Graphs with Fast Localized Spectral Filtering,2016-06-30,2016,8682,deep learning
1710.10196,"Progressive Growing of GANs for Improved Quality, Stability, and Variation",2017-10-27,2017,8658,implementation
2001.08361,Scaling Laws for Neural Language Models,2020-01-23,2020,8541,law
1903.11027,nuScenes: A Multimodal Dataset for Autonomous Driving,2019-03-26,2019,8522,computer vision; machine learning
1608.03981,Beyond a Gaussian Denoiser: Residual Learning of Deep CNN for Image Denoising,2016-08-13,2016,8498,algorithm
1606.04080,Matching Networks for One Shot Learning,2016-06-13,2016,8479,algorithm; deep learning; machine learning
1609.03499,WaveNet: A Generative Model for Raw Audio,2016-09-12,2016,8308,generative model
1703.01365,Axiomatic Attribution for Deep Networks,2017-03-04,2017,8276,chemistry; implementation
1606.06650,3D U-Net: Learning Dense Volumetric Segmentation from Sparse Annotation,2016-06-21,2016,8175,implementation
1502.05477,Trust Region Policy Optimization,2015-02-19,2015,8134,algorithm; robot
2312.00752,Mamba: Linear-Time Sequence Modeling with Selective State Spaces,2023-12-01,2023,8105,algorithm; deep learning
1607.00133,Deep Learning with Differential Privacy,2016-07-01,2016,8065,algorithm; deep learning; implementation; machine learning; software
1103.0398,Natural Language Processing (Almost) from Scratch,2011-02-01,2011,7928,algorithm; natural language processing
1910.11333,Quantum supremacy using a programmable superconducting processor,2019-10-23,2019,7883,algorithm
1506.02626,Learning both Weights and Connections for Efficient Neural Network,2015-06-08,2015,7822,embedded system
1901.08746,BioBERT: a pre-trained biomedical language representation model for biomedical text mining,2019-01-25,2019,7626,deep learning; implementation; natural language processing
1711.00937,Neural Discrete Representation Learning,2017-11-02,2017,7625,generative model; machine learning
1405.0301,"The automated computation of tree-level and next-to-leading order differential cross sections, and their matching to parton shower simulations",2014-05-01,2014,7584,automation; implementation; physics
2205.11916,Large Language Models are Zero-Shot Reasoners,2022-05-24,2022,7567,law; natural language processing
0912.3599,Robust principal component analysis?,2009-12-18,2009,7452,algorithm
1102.1523,The NumPy Array: A Structure for Efficient Numerical Computation,2011-02-07,2011,7420,implementation
1502.00956,ORB-SLAM: A Versatile and Accurate Monocular SLAM System,2015-02-03,2015,7374,algorithm
1806.07366,Neural Ordinary Differential Equations,2018-06-19,2018,7332,generative model
1212.0402,UCF101: A Dataset of 101 Human Actions Classes From Videos in The Wild,2012-12-03,2012,7251,database
1509.01626,Character-level Convolutional Networks for Text Classification,2015-09-04,2015,7189,deep learning
1708.05031,Neural Collaborative Filtering,2017-04-03,2017,7156,computer vision; deep learning; natural language processing
1911.09070,EfficientDet: Scalable and Efficient Object Detection,2019-11-20,2019,7154,computer vision
1812.08434,Graph Neural Networks: A Review of Methods and Applications,2018-12-20,2018,7146,disease; physics
2309.06180,Efficient Memory Management for Large Language Model Serving with PagedAttention,2023-09-12,2023,7113,algorithm; management; operating system
1802.09477,Addressing Function Approximation Error in Actor-Critic Methods,2018-02-26,2018,7107,algorithm; reinforcement learning
1606.08415,Gaussian Error Linear Units (GELUs),2016-06-27,2016,7082,computer vision; natural language processing
1409.7495,Unsupervised Domain Adaptation by Backpropagation,2014-09-26,2014,7022,deep learning
1609.04747,An overview of gradient descent optimization algorithms,2016-09-15,2016,6985,algorithm; machine learning
1711.03938,CARLA: An Open Urban Driving Simulator,2017-10-18,2017,6943,reinforcement learning
2108.07258,On the Opportunities and Risks of Foundation Models,2021-08-16,2021,6894,deep learning; law; robot; robotics
1803.01271,An Empirical Evaluation of Generic Convolutional and Recurrent Networks for Sequence Modeling,2018-03-04,2018,6852,deep learning
1607.02533,Adversarial examples in the physical world,2016-07-08,2016,6791,machine learning
2207.12598,Classifier-Free Diffusion Guidance,2022-07-26,2022,6739,generative model
1205.2618,BPR: Bayesian Personalized Ranking from Implicit Feedback,2009-06-18,2009,6714,algorithm
1411.1607,Julia: A Fresh Approach to Numerical Computing,2014-11-06,2014,6617,algorithm; computer science; law; programming language
1411.4555,Show and tell: A neural image caption generator,2014-11-17,2014,6598,artificial intelligence; computer vision; generative model; natural language processing
0710.3820,A brief introduction to PYTHIA 8.1,2007-10-20,2007,6519,physics
1611.01144,Categorical Reparameterization with Gumbel-Softmax,2016-11-03,2016,6503,generative model
1003.1594,Cuckoo Search via Lévy flights,2009-12-01,2009,6472,algorithm
0806.1256,Understanding individual human mobility patterns,2008-03-10,2008,6442,history; law
1712.00726,Cascade R-CNN: Delving Into High Quality Object Detection,2017-12-03,2017,6283,implementation
1503.04069,LSTM: A Search Space Odyssey,2015-03-13,2015,6281,machine learning
1703.04977,What Uncertainties Do We Need in Bayesian Deep Learning for Computer Vision?,2017-03-15,2017,6275,computer vision; deep learning
1707.07012,Learning Transferable Architectures for Scalable Image Recognition,2017-07-21,2017,6217,computer vision
2204.14198,Flamingo: a Visual Language Model for Few-Shot Learning,2022-04-29,2022,6214,machine learning
1908.07873,"Federated Learning: Challenges, Methods, and Future Directions",2019-08-21,2019,6154,machine learning
1709.10010,Advanced capabilities for materials modelling with Quantum ESPRESSO,2017-09-28,2017,6154,interoperability; software
1803.09015,Difference-in-Differences with multiple time periods,2018-03-23,2018,6098,software
1412.2306,Deep Visual-Semantic Alignments for Generating Image Descriptions,2014-12-06,2014,6086,statistics
1706.02275,Multi-Agent Actor-Critic for Mixed Cooperative-Competitive Environments,2017-06-07,2017,6081,reinforcement learning
1908.09635,A Survey on Bias and Fairness in Machine Learning,2019-08-23,2019,6075,accounting; artificial intelligence; deep learning; machine learning
1512.07108,Recent advances in convolutional neural networks,2015-12-22,2015,6010,computer vision; deep learning; natural language processing
2107.08430,YOLOX: Exceeding YOLO Series in 2021,2021-07-18,2021,5997,best practice; perception
1410.3012,An introduction to PYTHIA 8.2,2014-10-11,2014,5988,physics
2102.04306,TransUNet: Transformers Make Strong Encoders for Medical Image Segmentation,2021-02-08,2021,5971,disease
1611.01578,Neural Architecture Search with Reinforcement Learning,2016-11-04,2016,5965,reinforcement learning
1911.02685,A Comprehensive Survey on Transfer Learning,2019-11-07,2019,5943,machine learning
1111.6097,FastJet user manual,2011-11-25,2011,5923,implementation
2103.03874,Measuring Mathematical Problem Solving With the MATH Dataset,2021-03-05,2021,5892,machine learning; mathematics
1601.00670,Variational Inference: A Review for Statisticians,2016-01-04,2016,5818,machine learning; statistics
1907.05600,Generative Modeling by Estimating Gradients of the Data Distribution,2019-07-12,2019,5769,generative model
2102.05918,Scaling Up Visual and Vision-Language Representation Learning With Noisy Text Supervision,2021-02-11,2021,5759,perception
1702.04405,ScanNet: Richly-Annotated 3D Reconstructions of Indoor Scenes,2017-02-14,2017,5682,deep learning
1604.02878,Joint Face Detection and Alignment Using Multitask Cascaded Convolutional Networks,2016-04-11,2016,5670,deep learning
