arxiv_id,title,publicationDate,year,citationCount,terms
2303.04048,Is ChatGPT a Good NLG Evaluator? A Preliminary Study,2023-03-07,2023,640,linguistics
0911.2632,Measuring contextual citation impact of scientific journals,2009-11-13,2009,639,mathematics; scopus; social science
1911.03891,Social Bias Frames: Reasoning about Social and Power Implications of Language,2019-11-10,2019,639,categorization
1610.01206,A Survey of Multi-View Representation Learning,2016-10-03,2016,638,data mining
1905.11485,Representation Learning for Dynamic Graphs: A Survey,2019-05-28,2019,637,biology; finance
2403.07691,ORPO: Monolithic Preference Optimization without Reference Model,2024-03-12,2024,636,preference
1003.0694,Rivet user manual,2010-03-02,2010,635,operating system; programming language
1208.5986,The Bravyi-Kitaev transformation for quantum computation of electronic structure.,2012-08-29,2012,635,chemistry
2007.12324,Context-Aware Attentive Knowledge Tracing,2020-07-06,2020,634,personalization
1007.0085,Survey of Nearest Neighbor Techniques,2010-06-30,2010,634,categorization
2011.09926,Challenges in Deploying Machine Learning: A Survey of Case Studies,2020-11-18,2020,633,workflow
1807.10438,Internet of Things security and forensics: Challenges and opportunities,2018-07-27,2018,633,internet of things
1806.09099,Blockchain Technologies for the Internet of Things: Research Issues and Challenges,2018-06-24,2018,633,blockchain; internet of things
2211.05244,Deep Learning for Time Series Anomaly Detection: A Survey,2022-11-09,2022,632,economics
1704.03610,Blockchains for Business Process Management - Challenges and Opportunities,2017-04-12,2017,632,blockchain; process management
1703.07019,"Continuous Integration, Delivery and Deployment: A Systematic Review on Approaches, Tools, Challenges and Practices",2017-03-21,2017,632,software engineering; software engineering research; systematic review; thematic analysis
2106.07594,Graph Contrastive Learning Automated,2021-06-10,2021,632,best practice
2108.04884,Retiring Adult: New Datasets for Fair Machine Learning,2021-08-10,2021,631,narrative
1906.05398,Self-driving laboratory for accelerated discovery of thin-film materials,2019-06-12,2019,630,materials science
2205.10356,A Review of Deep Transfer Learning and Recent Advancements,2022-01-19,2022,630,best practice
2102.01998,"Unbox the black-box for the medical explainable AI via multi-modal and multi-centre data fusion: A mini-review, two showcases and beyond",2021-02-03,2021,629,explainable artificial intelligence (xai)
2004.02696,COVID-CAPS: A capsule network-based framework for identification of COVID-19 cases from X-ray images,2020-04-06,2020,629,health care
1910.03866,FastSurfer - A fast and accurate deep learning based neuroimaging pipeline,2019-10-09,2019,629,sustainability
2205.02302,"Machine Learning Operations (MLOps): Overview, Definition, and Architecture",2022-05-04,2022,629,best practice; workflow
1909.11573,Deep learning for deepfakes creation and detection: A survey,2019-09-25,2019,628,analytics; big data
1801.06275,IoT Security Techniques Based on Machine Learning: How Do IoT Devices Use AI to Enhance Security?,2018-01-19,2018,628,internet of things
1405.0425,Structural reducibility of multilayer networks,2014-05-02,2014,628,accounting
2106.07688,Next generation reservoir computing,2021-06-14,2021,627,artificial neural network
0910.2899,Bacterial ratchet motors,2009-10-15,2009,627,nanotechnology
2106.05081,Global Context Enhanced Graph Neural Networks for Session-based Recommendation,2020-07-25,2020,626,preference
1401.3841,Narrative Planning: Balancing Plot and Character,2010-09-01,2010,626,narrative
1106.0286,Popularity versus similarity in growing networks,2011-06-01,2011,625,preference
2306.04141,Art and the science of generative AI,2023-06-07,2023,624,creativity; economics; visual arts
1611.01989,DeepCoder: Learning to Write Programs,2016-11-04,2016,624,programming language
1207.2743,The evolutionary origins of modularity,2012-07-11,2012,624,genetics; neuroscience
2110.00476,ResNet strikes back: An improved training procedure in timm,2021-10-01,2021,624,best practice
2005.08025,IntelliCode compose: code generation using transformer,2020-05-16,2020,623,programming language
2006.13932,AI-based pathology predicts origins for cancers of unknown primary,2020-06-24,2020,623,cancer; pathology
2011.08612,"Empowering Things With Intelligence: A Survey of the Progress, Challenges, and Opportunities in Artificial Intelligence of Things",2020-11-17,2020,623,cloud computing; internet of things
2307.08177,Using an LLM to Help with Code Understanding,2023-07-17,2023,623,documentation
1709.06009,Revisiting the Arcade Learning Environment: Evaluation Protocols and Open Problems for General Agents,2017-09-18,2017,623,best practice
2004.04197,Quantum approximate optimization of non-planar graph problems on a planar superconducting processor,2020-04-08,2020,622,finance
1606.02840,Decoding Dynamic Brain Patterns from Evoked Responses: A Tutorial on Multivariate Pattern Analysis Applied to Time Series Neuroimaging Data,2016-06-09,2016,622,neuroscience
1603.06995,Multi-Scale Convolutional Neural Networks for Time Series Classification,2016-03-22,2016,621,data mining
1502.00164,A Survey on Internet of Things From Industrial Market Perspective,2015-01-31,2015,621,conceptual framework; internet of things
2510.02861,The European Union general data protection regulation: what it is and what it means*,2019-01-02,2019,620,european union; normative
1904.06493,Rethinking Classification and Localization for Object Detection,2019-04-13,2019,620,preference
2007.15584,The effects of remote work on collaboration among information workers,2020-07-30,2020,620,coronavirus disease 2019 (covid-19)
1405.2881,Consistency of Random Forests,2014-05-12,2014,619,data science; ecology
1603.06212,Evaluation of a Tree-based Pipeline Optimization Tool for Automating Data Science,2016-03-20,2016,619,data science
1802.06916,Simplicial closure and higher-order link prediction,2018-02-20,2018,619,accounting; biology; medicine
2001.04407,FeynCalc 9.3: New features and improvements,2020-01-13,2020,619,interoperability; programming language
math/0606278,Network-Based Marketing: Identifying Likely Adopters Via Consumer Networks,2006-05-01,2006,618,best practice; marketing; telecommunications
1905.00931,Deep Learning in Alzheimer's Disease: Diagnostic Classification and Prognostic Prediction Using Neuroimaging Data,2019-05-02,2019,618,systematic review
1711.10980,Toward the first quantum simulation with quantum speedup,2017-11-29,2017,617,chemistry
1904.00043,Quantum Generative Adversarial Networks for learning and loading random distributions,2019-03-29,2019,616,finance
1203.5885,MALDIquant: a versatile R package for the analysis of mass spectrometry data,2012-03-27,2012,616,documentation
1509.08062,End-to-end text-dependent speaker verification,2015-09-27,2015,615,big data
2307.07635,CoTracker: It is Better to Track Together,2023-07-14,2023,615,accounting
2007.02265,AM-GCN: Adaptive Multi-channel Graph Convolutional Networks,2020-07-05,2020,615,analytics
1405.3267,Exact Recovery in the Stochastic Block Model,2014-05-13,2014,614,computer science
1205.2662,On Smoothing and Inference for Topic Models,2009-06-18,2009,614,topic modeling
1607.03597,Accelerating Eulerian Fluid Simulation With Convolutional Networks,2016-07-13,2016,614,mathematics
2207.08815,Why do tree-based models still outperform deep learning on tabular data?,2022-07-18,2022,614,accounting
2003.02437,Drone-Based RGB-Infrared Cross-Modality Vehicle Detection Via Uncertainty-Aware Learning,2020-03-05,2020,614,smart city
2307.15189,Med-Flamingo: a Multimodal Medical Few-shot Learner,2023-07-27,2023,613,medicine
1503.05296,Efficient Machine Learning for Big Data: A Review,2015-03-18,2015,613,big data; emerging technologies
2312.00506,Generative AI enhances individual creativity but reduces the collective diversity of novel content,2023-12-01,2023,613,creativity
1901.04520,astroquery: An Astronomical Web-querying Package in Python,2019-01-14,2019,611,documentation; philosophy; workflow
1906.00331,On Gradient Descent Ascent for Nonconvex-Concave Minimax Problems,2019-06-02,2019,610,economics
2202.01032,"Understanding O-RAN: Architecture, Interfaces, Algorithms, Security, and Research Challenges",2022-02-02,2022,610,workflow
1306.4933,A Nonparametric Approach for Multiple Change Point Analysis of Multivariate Data,2013-06-20,2013,609,finance; genetics
1808.04930,Learning data-driven discretizations for partial differential equations,2018-08-15,2018,608,accounting
1909.02487,Ab-Initio Solution of the Many-Electron Schrödinger Equation with Deep Neural Networks,2019-09-05,2019,608,chemistry
0911.2719,Betweenness centrality as an indicator of the interdisciplinarity of scientific journals,2007-07-01,2007,607,nanotechnology; social science
1401.1406,BigDataBench: A big data benchmark suite from internet services,2014-01-06,2014,607,big data
1801.06889,Visual Analytics in Deep Learning: An Interrogative Survey for the Next Frontiers,2018-01-21,2018,606,analytics
1312.5847,Deep learning for neuroimaging: a validation study,2013-12-20,2013,606,neuroscience
2003.12206,Improving Reproducibility in Machine Learning Research (A Report from the NeurIPS 2019 Reproducibility Program),2020-03-27,2020,605,workflow
1901.05335,A Review of Domain Adaptation without Target Labels,2019-01-16,2019,605,categorization
2111.12444,"Edge Artificial Intelligence for 6G: Vision, Enabling Technologies, and Applications",2021-11-24,2021,604,analytics; big data
0907.0786,Search-based structured prediction,2009-06-01,2009,602,biology; computational biology
2105.00691,Hybrid Intelligence,2019-03-28,2019,602,human intelligence
1911.09290,Large-scale Multi-view Subspace Clustering in Linear Time,2019-11-21,2019,601,big data
1606.03508,"Materials that couple sensing, actuation, computation, and communication",2015-03-20,2015,600,computer science; materials science; mathematics
1609.00893,Tensor Networks for Dimensionality Reduction and Large-scale Optimization: Part 1 Low-Rank Tensor Decompositions,2016-09-04,2016,600,data science
1610.04662,Deep learning ensembles for melanoma recognition in dermoscopy images,2016-10-14,2016,599,cancer
1803.09574,Long short-term memory and Learning-to-learn in networks of spiking neurons,2018-03-26,2018,599,artificial neural network
1808.04730,Analyzing Inverse Problems with Invertible Neural Networks,2018-08-14,2018,598,medicine
1811.05181,Gradient Harmonized Single-stage Detector,2018-11-13,2018,597,philosophy
2008.11659,Large-scale neuromorphic optoelectronic computing with a reconfigurable diffractive processing unit,2020-08-26,2020,597,artificial neural network
2303.13948,Knowledge Graphs: Opportunities and Challenges,2023-03-24,2023,596,big data
1710.07629,OpenFermion: the electronic structure package for quantum computers,2017-10-20,2017,596,chemistry; documentation
1510.02855,AtomNet: A Deep Convolutional Neural Network for Bioactivity Prediction in Structure-based Drug Discovery,2015-10-10,2015,596,drug; drug discovery
1609.05362,Mobile Edge Computing via a UAV-Mounted Cloudlet: Optimization of Bit Allocation and Path Planning,2016-09-17,2016,596,cloud computing
1910.13312,"Security of the Internet of Things: Vulnerabilities, Attacks, and Countermeasures",2019-10-29,2019,595,internet of things
1903.08297,Deep Neural Networks Improve Radiologists’ Performance in Breast Cancer Screening,2019-03-20,2019,595,cancer
2406.15877,BigCodeBench: Benchmarking Code Generation with Diverse Function Calls and Complex Instructions,2024-06-22,2024,594,automation; software engineering
1904.10674,Deep Learning for Classification of Hyperspectral Data: A Comparative Review,2019-04-24,2019,594,multimedia
quant-ph/0703255,Quantum Communication,2007-03-27,2007,593,computer science; mathematics
1701.06307,A tutorial on modeling and analysis of dynamic social networks. Part I,2017-01-23,2017,593,big data
1804.03757,Control of Connected and Automated Vehicles: State of the Art and Future Challenges,2018-04-11,2018,593,automation
1711.00141,Training GANs with Optimism,2017-10-01,2017,593,bioinformatics
2104.01776,Federated Learning Meets Blockchain in Edge Computing: Opportunities and Challenges,2021-04-05,2021,593,blockchain; incentive
2108.13323,Communication-efficient federated learning via knowledge distillation,2021-08-30,2021,593,personalization
2305.02878,The AI generation gap: Are Gen Z students more interested in adopting generative AI such as ChatGPT in teaching and learning than their Gen X and millennial generation teachers?,2023-05-04,2023,592,higher education; literacy
1302.7007,Integration of nanoscale memristor synapses in neuromorphic computing architectures,2013-02-27,2013,592,artificial neural network; neuroscience
2410.13720,Movie Gen: A Cast of Media Foundation Models,2024-10-17,2024,592,personalization
2009.11698,Principles and Practice of Explainable Machine Learning,2020-09-18,2020,591,biology; computational biology; data science; finance; narrative; stakeholder
1410.4615,Learning to Execute,2014-10-16,2014,591,curriculum
2305.02231,"Connecting the Dots in Trustworthy Artificial Intelligence: From AI Principles, Ethics, and Key Requirements to Responsible AI Systems and Regulation",2023-05-02,2023,590,accountability
1807.04518,"Turning big data into tiny data: Constant-size coresets for k-means, PCA and projective clustering",2013-01-06,2013,590,big data
1908.06287,Scheduling Policies for Federated Learning in Wireless Networks,2019-08-17,2019,590,accounting
1509.02505,The Master Equation and the Convergence Problem in Mean Field Games,2015-09-08,2015,589,economics; finance; mathematics
2301.13867,Mathematical Capabilities of ChatGPT,2023-01-31,2023,589,mathematics
2106.00647,"Mapping the NFT revolution: market trends, trade networks, and visual features",2021-06-01,2021,589,blockchain
2101.04719,Expanding Explainability: Towards Social Transparency in AI systems,2021-01-12,2021,589,conceptual framework
2002.03491,Massive Access for 5G and Beyond,2020-02-10,2020,588,internet of things
2106.09553,Large-scale chemical language representations capture molecular structure and properties,2021-06-17,2021,588,drug; drug discovery
1807.00123,"Machine Learning for Integrating Data in Biology and Medicine: Principles, Practice, and Opportunities",2018-06-30,2018,585,biology; medicine
2410.05229,GSM-Symbolic: Understanding the Limitations of Mathematical Reasoning in Large Language Models,2024-10-07,2024,585,mathematics
1505.03046,Improving Computer-aided Detection using Convolutional Neural Networks and Random View Aggregation,2015-05-12,2015,585,pathology
1509.03150,STC: A Simple to Complex Framework for Weakly-Supervised Semantic Segmentation,2015-09-10,2015,585,finance
1501.05387,Gunrock: a high-performance graph processing library on the GPU,2015-01-21,2015,585,analytics
1811.02114,DeepConv-DTI: Prediction of drug-target interactions via deep learning with convolution on protein sequences,2018-11-06,2018,585,drug; drug discovery
1902.02181,Attention in Natural Language Processing,2019-02-04,2019,585,categorization
2104.05704,Escaping the Big Data Paradigm with Compact Transformers,2021-04-12,2021,584,big data
1111.0062,Optimal and Approximate Q-value Functions for Decentralized POMDPs,2008-05-01,2008,583,normative
1306.0413,GWmodel: An R Package for Exploring Spatial Heterogeneity Using Geographically Weighted Models,2013-06-03,2013,582,social science
1705.06366,Automatic Goal Generation for Reinforcement Learning Agents,2017-05-17,2017,581,curriculum
1809.00343,Towards an Intelligent Edge: Wireless Communication Meets Machine Learning,2018-09-02,2018,580,internet of things
1509.06041,Robust Image Sentiment Analysis Using Progressively Trained and Domain Transferred Deep Networks,2015-01-25,2015,580,analytics
2112.08936,Perception and sensing for autonomous vehicles under adverse weather conditions: A survey,2021-12-16,2021,577,computer science
1904.03626,On The Power of Curriculum Learning in Training Deep Networks,2019-04-07,2019,577,curriculum
2009.10576,Ethical Machine Learning in Healthcare,2020-09-22,2020,576,machine learning in healthcare
1305.1707,Class Imbalance Problem in Data Mining Review,2013-05-07,2013,576,data mining
2101.10382,Curriculum Learning: A Survey,2021-01-25,2021,576,curriculum
1502.01710,Text Understanding from Scratch,2015-02-05,2015,575,categorization
2011.08641,A Review of Generalized Zero-Shot Learning Methods,2020-11-17,2020,575,categorization
2303.17568,CodeGeeX: A Pre-Trained Model for Code Generation with Multilingual Benchmarking on HumanEval-X,2023-03-30,2023,573,programming language
1705.07565,Learning to Prune Deep Neural Networks via Layer-wise Optimal Brain Surgeon,2017-05-01,2017,573,embedded system
1710.09918,EduCTX: A Blockchain-Based Higher Education Credit Platform,2017-10-26,2017,573,blockchain; higher education; stakeholder
cond-mat/0507216,Origins of fractality in the growth of complex networks,2005-07-08,2005,572,biology; sociology
1203.1739,Libxc: A library of exchange and correlation functionals for density functional theory,2012-03-08,2012,572,operating system; programming language
1807.01069,Adversarial Robustness Toolbox v1.0.0,2018-07-03,2018,572,documentation
1609.01596,Direct Feedback Alignment Provides Learning in Deep Neural Networks,2016-09-01,2016,572,artificial neural network
1504.01163,AiiDA: Automated Interactive Infrastructure and Database for Computational Science,2015-04-05,2015,571,automation; computer science; materials science; workflow
1505.01596,Learning to See by Moving,2015-05-07,2015,571,biology
0903.2525,CloudSim: A Novel Framework for Modeling and Simulation of Cloud Computing Infrastructures and Services,2009-03-13,2009,571,cloud computing
2006.03511,Unsupervised Translation of Programming Languages,2020-06-05,2020,570,programming language
1208.4174,Interactive Analytical Processing in Big Data Systems: A Cross-Industry Study of MapReduce Workloads,2012-08-01,2012,570,big data; telecommunications
2509.19867,Robustness and resilience of complex networks,2024-01-08,2024,569,biology; neuroscience
2209.02646,A Survey on Generative Diffusion Models,2022-09-06,2022,569,biology; creativity
1907.07980,Automated deep-learning system for Gleason grading of prostate cancer using biopsies: a diagnostic study.,2019-07-18,2019,569,cancer; pathology
1610.09460,Building energy load forecasting using Deep Neural Networks,2016-10-01,2016,569,sustainability
1604.06443,Robust Estimators in High Dimensions without the Computational Intractability,2016-04-21,2016,568,computer science
1803.02349,Billion-scale Commodity Embedding for E-commerce Recommendation in Alibaba,2018-03-06,2018,568,workflow
2412.09315,"Beware of Metacognitive Laziness: Effects of Generative Artificial Intelligence on Learning Motivation, Processes, and Performance",2024-12-10,2024,568,analytics; empirical research
1501.02530,A dataset for Movie Description,2015-01-11,2015,568,linguistics
1707.02919,"A Brief Survey of Text Mining: Classification, Clustering and Extraction Techniques",2017-07-10,2017,567,health care
1404.3785,Reducing the Barrier to Entry of Complex Robotic Software: a MoveIt! Case Study,2014-04-14,2014,567,best practice; software engineering
physics/0611158,Mixture models and exploratory analysis in networks,2006-11-15,2006,567,social science
1911.06633,HealthFog: An Ensemble Deep Learning based Smart Healthcare System for Automatic Diagnosis of Heart Diseases in Integrated IoT and Fog Computing Environments,2019-11-15,2019,567,big data; cloud computing; internet of things
2401.03048,Latte: Latent Diffusion Transformer for Video Generation,2024-01-05,2024,567,best practice
2004.04741,The challenges of modeling and forecasting the spread of COVID-19,2020-04-09,2020,566,coronavirus disease 2019 (covid-19); public health
1503.00674,5G cellular: key enabling technologies and research challenges,2015-02-16,2015,566,emerging technologies
1106.0667,Reasoning within Fuzzy Description Logics,2011-06-03,2011,564,multimedia
1406.1446,Classical Mathematical Models for Description and Prediction of Experimental Tumor Growth,2014-06-05,2014,563,cancer; drug
1408.1667,Science vs Conspiracy: Collective Narratives in the Age of Misinformation,2014-08-07,2014,563,narrative
1902.02647,"Wireless Networks Design in the Era of Deep Learning: Model-Based, AI-Based, or Both?",2019-02-05,2019,563,artificial neural network
2102.07817,What Do We Want From Explainable Artificial Intelligence (XAI)? - A Stakeholder Perspective on XAI and a Conceptual Model Guiding Interdisciplinary XAI Research,2021-02-15,2021,562,explainable artificial intelligence (xai); stakeholder
1802.08452,Sequence-Aware Recommender Systems,2018-02-23,2018,562,categorization; data mining
1005.4006,Temporal Link Prediction Using Matrix and Tensor Factorizations,2010-05-21,2010,561,data mining
2004.11424,MolTrans: Molecular Interaction Transformer for drug–target interaction prediction,2020-04-23,2020,561,bioinformatics; drug; drug discovery
1403.3100,Engaging with massive online courses,2014-03-12,2014,561,conceptual framework; incentive
2211.11501,DS-1000: A Natural and Reliable Benchmark for Data Science Code Generation,2022-11-18,2022,560,data science
2402.13178,Benchmarking Retrieval-Augmented Generation for Medicine,2024-02-20,2024,560,best practice; medicine
1111.3633,Quantum Algorithms for Quantum Field Theories,2011-11-15,2011,560,mathematics
2305.03514,Can Large Language Models Transform Computational Social Science?,2023-04-12,2023,560,best practice; social science
2105.07624,TAT-QA: A Question Answering Benchmark on a Hybrid of Tabular and Textual Content in Finance,2021-05-17,2021,560,finance
1910.06837,Reliable Federated Learning for Mobile Networks,2019-10-14,2019,560,blockchain
2012.05876,Neurosymbolic AI: the 3rd wave,2020-12-10,2020,559,accountability
1901.02715,"Blockchain in global supply chains and cross border trade: a critical synthesis of the state-of-the-art, challenges and opportunities",2019-01-05,2019,559,blockchain; supply chain
2112.06409,Data collection and quality challenges in deep learning: a data-centric AI perspective,2021-12-13,2021,558,big data; software engineering
1707.00143,Fast Approximate Nearest Neighbor Search With The Navigating Spreading-out Graph,2017-07-01,2017,558,data mining
2101.00292,Jamming Attacks and Anti-Jamming Strategies in Wireless Networks: A Comprehensive Survey,2021-01-01,2021,558,telecommunications
2401.10935,SeeClick: Harnessing GUI Grounding for Advanced Visual GUI Agents,2024-01-17,2024,557,automation
2012.15816,Fairness in Machine Learning,2020-12-31,2020,557,ethical issues
1711.04574,Learning Explanatory Rules from Noisy Data,2017-11-13,2017,557,artificial neural network
2501.18737,Complex network approaches to nonlinear time series analysis,2019-01-01,2019,556,economics
1505.07683,Privacy in the Internet of Things: threats and challenges,2014-12-01,2014,555,internet of things
1501.04158,On the performance of ConvNet features for place recognition,2015-01-16,2015,555,categorization
1511.04453,The multilayer nature of ecological networks,2015-11-13,2015,554,ecology
2001.09382,GraphAF: a Flow-based Autoregressive Model for Molecular Graph Generation,2020-01-26,2020,553,drug; drug discovery
2212.14882,ChatGPT makes medicine easy to swallow: an exploratory case study on simplified radiology reports,2022-12-30,2022,552,categorization; medicine; radiology
2203.06935,"A Systematic Review on Affective Computing: Emotion Models, Databases, and Recent Advances",2022-03-01,2022,552,multimedia; systematic review
1406.2952,Bird Species Categorization Using Pose Normalized Deep Convolutional Nets,2014-06-11,2014,552,categorization
1808.07664,Artificial neural networks trained through deep reinforcement learning discover control strategies for active flow control,2018-08-23,2018,552,artificial neural network
2012.03854,Forecasting: theory and practice,2020-12-04,2020,551,economics; finance; systematic review
2302.06527,An Empirical Evaluation of Using Large Language Models for Automated Unit Test Generation,2023-02-13,2023,551,automation; documentation
1909.08423,Deep-neural-network solution of the electronic Schrödinger equation,2019-09-16,2019,551,chemistry
1910.01258,"Integrating machine learning and multiscale modeling—perspectives, challenges, and opportunities in the biological, biomedical, and behavioral sciences",2019-10-03,2019,550,biology; computational biology; computer science; mathematics; medicine
2009.11169,Whole slide images based cancer survival prediction using attention guided deep multiple instance learning networks,2020-07-19,2020,550,cancer; medicine
2011.02833,"Digital Twins: State of the Art Theory and Practice, Challenges, and Open Research Questions",2020-11-02,2020,550,big data; internet of things
1908.04507,A Survey on Ethereum Systems Security,2019-08-13,2019,550,blockchain
1702.05374,Domain Adaptation for Visual Applications: A Comprehensive Survey,2017-02-17,2017,550,categorization
1610.02085,Influence of Pokémon Go on Physical Activity: Study and Implications,2016-10-06,2016,549,public health
2307.14334,Towards Generalist Biomedical AI,2023-07-26,2023,548,medicine; radiology
2011.14844,6G Networks: Beyond Shannon Towards Semantic and Goal-Oriented Communications,2020-11-04,2020,548,sustainability
1603.04259,ITEM2VEC: Neural item embedding for collaborative filtering,2016-03-14,2016,548,linguistics
2004.03997,Assessing the risks of ‘infodemics’ in response to COVID-19 epidemics,2020-04-08,2020,548,public health
