arxiv_id,title,publicationDate,year,citationCount,terms
2303.11032,DeID-GPT: Zero-shot Medical Text De-Identification by GPT-4,2023-03-20,2023,230,accountability
2010.02809,Deep Representation Learning of Patient Data from Electronic Health Records (EHR): A Systematic Review,2020-10-06,2020,230,medline; scopus
2211.15979,AirFormer: Predicting Nationwide Air Quality in China with Transformers,2022-11-29,2022,230,economic growth
2107.10670,Structure-aware Interactive Graph Neural Networks for the Prediction of Protein-Ligand Binding Affinity,2021-07-21,2021,230,drug discovery
2506.09113,Seedance 1.0: Exploring the Boundaries of Video Generation Models,2025-06-10,2025,230,narrative
1901.03597,CT-GAN: Malicious Tampering of 3D Medical Imagery using Deep Learning,2019-01-11,2019,230,radiology
2207.07051,Language models show human-like content effects on reasoning,2022-07-14,2022,229,human intelligence
2303.10323,Dynamic Graph Enhanced Contrastive Learning for Chest X-Ray Report Generation,2023-03-18,2023,229,radiology
2101.10198,"Cyber-Physical Energy Systems Security: Threat Modeling, Risk Assessment, Resources, Metrics, and Case Studies",2021-01-25,2021,229,interoperability
2001.00258,A generalized deep learning framework for whole-slide image segmentation and analysis,2020-01-01,2020,228,pathology
2408.00738,Virchow2: Scaling Self-Supervised Mixed Magnification Models in Pathology,2024-08-01,2024,228,pathology
2203.07747,Real-Time Neural MPC: Deep Learning Model Predictive Control for Quadrotors and Agile Robotic Platforms,2022-03-15,2022,228,embedded system
1409.0257,Perceptual Decision-Making as Probabilistic Inference by Neural Sampling.,2014-08-31,2014,228,normative
1501.03024,High performance photonic reservoir computer based on a coherently driven passive cavity,2015-01-13,2015,228,telecommunications
2007.01524,Domain Adaptation Without Source Data,2020-07-03,2020,228,stakeholder
2005.07704,Improved Protein-ligand Binding Affinity Prediction with Structure-Based Deep Fusion Inference,2020-05-17,2020,228,drug discovery
1712.05898,NegBio: a high-performance tool for negation and uncertainty detection in radiology reports,2017-12-16,2017,228,radiology
2309.09812,R2GenGPT: Radiology Report Generation with Frozen LLMs,2023-09-18,2023,228,radiology
1904.11679,Fake News Early Detection,2019-04-26,2019,227,psychology
1905.10688,Sherlock: A Deep Learning Approach to Semantic Data Type Detection,2019-05-25,2019,227,data science
1611.05125,Learning to Score Olympic Events,2016-11-16,2016,227,health care
1212.4779,StaticGreedy: solving the scalability-accuracy dilemma in influence maximization,2012-12-19,2012,227,marketing
1909.01716,ScisummNet: A Large Annotated Corpus and Content-Impact Models for Scientific Paper Summarization with Citation Networks,2019-07-17,2019,227,linguistics
1712.00358,Unsupervised Generative Adversarial Cross-modal Hashing,2017-12-01,2017,227,multimedia
1603.04939,"Grand challenges in altmetrics: heterogeneity, data quality and dependencies",2016-03-14,2016,227,conceptual framework
2305.15778,Automatic Root Cause Analysis via Large Language Models for Cloud Incidents,2023-05-25,2023,227,narrative
1902.01109,Strategies for Structuring Story Generation,2019-02-04,2019,227,narrative
2411.16609,F--a model of events based on the foundational ontology dolce+DnS ultralight,2009-09-01,2009,227,interoperability
2105.06496,"Deepfake detection by human crowds, machines, and machine-informed crowds",2021-05-13,2021,227,moderation
2012.08496,Spectral Methods for Data Science: A Statistical Perspective,2020-12-15,2020,226,data science
2006.13311,70 years of machine learning in geoscience in review,2020-06-16,2020,226,geology
1905.05908,Task-Driven Modular Networks for Zero-Shot Compositional Learning,2019-05-15,2019,226,human intelligence
2304.08295,Interactive and Explainable Region-guided Radiology Report Generation,2023-04-17,2023,226,radiology
1402.1718,On Subversive Miner Strategies and Block Withholding Attack in Bitcoin Digital Currency,2014-01-28,2014,226,incentive
1809.04399,Artificial intelligence for the public sector: opportunities and challenges of cross-sector collaboration,2018-08-06,2018,225,data science
1404.4606,How Many Topics? Stability Analysis for Topic Models,2014-04-16,2014,225,topic modeling
2205.11402,Causal machine learning for healthcare and precision medicine,2022-05-23,2022,225,clinical decision support system; decision support system; precision medicine
1806.05707,Variational quantum algorithms for discovering Hamiltonian spectra,2018-06-14,2018,225,drug discovery
2303.13534,Prompting AI Art: An Investigation into the Creative Skill of Prompt Engineering,2023-03-13,2023,225,creativity
2107.02963,Disentangle Your Dense Object Detector,2021-07-07,2021,225,multimedia
2105.08209,BookSum: A Collection of Datasets for Long-form Narrative Summarization,2021-05-18,2021,225,narrative
2106.03521,RedditBias: A Real-World Resource for Bias Evaluation and Debiasing of Conversational Language Models,2021-06-07,2021,225,ethical issues
1907.12720,Exploring large scale public medical image datasets,2019-07-30,2019,225,radiology
2204.07198,RIS-Assisted Visible Light Communication Systems: A Tutorial,2022-04-14,2022,225,emerging technologies
1412.6159,Human-Data Interaction: The Human Face of the Data-Driven Society,2014-10-01,2014,224,psychology; sociology
2008.10740,Data-Driven Aerospace Engineering: Reframing the Industry with Machine Learning,2020-08-24,2020,224,data science
1801.06814,Curriculum Guidelines for Undergraduate Programs in Data Science,2017-03-10,2017,224,data science
0812.0438,An Introduction to Knowledge Management,2008-12-02,2008,224,knowledge management
2205.09671,A Graph-Transformer for Whole Slide Image Classification,2022-05-19,2022,224,pathology
2202.10894,Quantum Internet Protocol Stack: a Comprehensive Survey,2022-02-22,2022,224,telecommunications
2411.15738,AnyEdit: Mastering Unified High-Quality Image Editing for Any Idea,2024-11-24,2024,224,creativity
2005.10831,Repurpose Open Data to Discover Therapeutics for COVID-19 Using Deep Learning,2020-05-21,2020,224,coronavirus disease 2019 (covid-19)
1710.01801,FOCAN: A Fog-supported Smart City Network Architecture for Management of Applications in the Internet of Everything Environments,2017-10-04,2017,224,smart city
1903.08402,High-Index Dielectric Metasurfaces Performing Mathematical Operations,2019-03-20,2019,224,emerging technologies
0809.0124,"A Uniform Approach to Analogies, Synonyms, Antonyms, and Associations",2008-08-18,2008,223,cognitive psychology; psychology
1808.05502,A survey on influence maximization in a social network,2018-08-16,2018,223,marketing
0807.0247,Agent-based modeling of host–pathogen systems: The successes and challenges,2008-07-02,2008,223,pathology
2112.15009,Knowledge matters: Chest radiology report generation with general and specific knowledge,2021-12-30,2021,223,radiology
2101.12270,An Experimental Analysis of Attack Classification Using Machine Learning in IoT Networks,2021-01-01,2021,223,incentive
1804.09070,"International research collaboration: Novelty, conventionality, and atypicality in knowledge recombination",2018-04-24,2018,223,scopus
1903.10489,Interplay Between NOMA and Other Emerging Technologies: A Survey,2019-03-25,2019,223,emerging technologies
2511.08072,Clustering-based anomaly detection in multivariate time series data,2021-03-01,2021,222,health care
1807.07468,Latent Dirichlet Allocation (LDA) for Topic Modeling of the CFPB Consumer Complaints,2018-07-18,2018,222,narrative; topic modeling
1610.03013,Display Advertising with Real-Time Bidding (RTB) and Behavioural Targeting,2016-10-07,2016,222,marketing
1606.00626,The Challenge of Non-Technical Loss Detection Using Artificial Intelligence: A Survey,2016-06-02,2016,222,electrical engineering
2102.07916,Few-Shot Graph Learning for Molecular Property Prediction,2021-02-16,2021,222,drug discovery
2312.05235,"Generative AI in higher education: Seeing ChatGPT through universities' policies, resources, and guidelines",2023-12-08,2023,222,higher education
1611.02796,Sequence Tutor: Conservative Fine-Tuning of Sequence Generation Models with KL-control,2016-11-09,2016,222,incentive
1908.05376,Maximum Relevance and Minimum Redundancy Feature Selection Methods for a Marketing Machine Learning Platform,2019-08-15,2019,221,marketing
1803.04565,Learning to recognize Abnormalities in Chest X-Rays with Location-Aware Dense Networks,2018-03-12,2018,221,pathology
2303.11568,"Large AI Models in Health Informatics: Applications, Challenges, and the Future",2023-03-21,2023,221,health informatics; medical education; public health
1312.5080,Research Directions in Network Service Chaining,2013-11-01,2013,221,telecommunications
1508.00188,Explore Spatiotemporal and Demographic Characteristics of Human Mobility via Twitter: A Case Study of Chicago,2015-08-02,2015,221,public health
2009.05383,COVIDNet-CT: A Tailored Deep Convolutional Neural Network Design for Detection of COVID-19 Cases From Chest CT Images,2020-09-08,2020,221,coronavirus disease 2019 (covid-19)
2203.01340,Is Quantum Advantage the Right Goal for Quantum Machine Learning?,2022-03-02,2022,221,narrative
0705.0467,Many random walks are faster than one,2007-05-03,2007,221,distributed computing
2404.00971,Beyond Functional Correctness: Exploring Hallucinations in LLM-Generated Code,2024-04-01,2024,221,thematic analysis
2403.14814,The Opportunities and Risks of Large Language Models in Mental Health,2024-03-21,2024,220,health care
1911.08089,"""The human body is a black box"": supporting clinical decision-making with deep learning",2019-11-19,2019,220,accountability; stakeholder
2308.03588,Multi-View Graph Convolutional Network for Multimedia Recommendation,2023-08-07,2023,220,multimedia
1804.04777,"Optimizing Bloom Filter: Challenges, Solutions, and Comparisons",2018-04-13,2018,219,philosophy
2103.01768,"Air taxi service for urban mobility: A critical review of recent developments, future challenges, and opportunities",2020-11-01,2020,219,operations management
2005.05235,Machine Learning for Materials Developments in Metals Additive Manufacturing,2020-05-11,2020,219,electrical engineering; materials science
1908.03092,Motivating Workers in Federated Learning: A Stackelberg Game Perspective,2019-08-06,2019,219,incentive
0802.2001,Exploiting problem structure in a genetic algorithm approach to a nurse rostering problem,2008-02-14,2008,219,incentive
2306.10374,A Survey of Contextual Optimization Methods for Decision Making under Uncertainty,2023-06-17,2023,219,operations research
2110.04600,A Review of Physics-based Machine Learning in Civil Engineering,2021-10-09,2021,219,civil engineering
2406.15513,PKU-SafeRLHF: Towards Multi-Level Safety Alignment for LLMs with Human Preference,2024-06-20,2024,219,moderation
2010.06047,"Artificial Intelligence, Speech, and Language Processing Approaches to Monitoring Alzheimer’s Disease: A Systematic Review",2020-10-12,2020,218,psychology
1311.2694,Hypothesis testing for automated community detection in networks,2013-11-12,2013,218,world wide web
1111.4729,Influence diffusion dynamics and influence maximization in social networks with friend and foe relationships,2011-11-20,2011,218,marketing
2306.07999,Artificial intelligence in digital pathology: a systematic review and meta-analysis of diagnostic test accuracy,2023-06-13,2023,218,pathology
1910.00091,Deep Coordination Graphs,2019-09-25,2019,218,pathology
1904.02422,Resource Efficient 3D Convolutional Neural Networks,2019-04-04,2019,218,embedded system
2004.05645,Residual Attention U-Net for Automated Multi-Class Segmentation of COVID-19 Chest CT Images,2020-04-12,2020,218,coronavirus disease 2019 (covid-19); public health
2503.21755,VBench-2.0: Advancing Video Generation Benchmark Suite for Intrinsic Faithfulness,2025-03-27,2025,218,creativity
1805.05081,Constructing Narrative Event Evolutionary Graph for Script Event Prediction,2018-05-14,2018,218,narrative
1805.04360,Quantum internet: from communication to distributed computing!,2018-05-11,2018,218,distributed computing
2202.10261,A Self-Supervised Descriptor for Image Copy Detection,2022-02-21,2022,218,moderation
1407.7131,Your click decides your fate: Inferring Information Processing and Attrition Behavior from MOOC Video Clickstream Interactions,2014-07-26,2014,217,cognitive psychology; psychology
2212.07796,@ CREPE: Can Vision-Language Foundation Models Reason Compositionally?,2022-12-13,2022,217,cognitive science
1111.4297,Battling the Internet water army: Detection of hidden paid posters,2011-11-18,2011,217,marketing
2003.07258,CLEVR-XAI: A benchmark dataset for the ground truth evaluation of neural network explanations,2020-03-16,2020,217,accountability
1901.08152,Veridical data science,2019-01-23,2019,217,narrative
1209.3442,Negative Binomial Process Count and Mixture Modeling,2012-09-15,2012,216,topic modeling
1909.07913,Learning to Deceive with Attention-Based Explanations,2019-09-17,2019,216,accountability; stakeholder
1706.04507,A Blockchain-based Approach for Data Accountability and Provenance Tracking,2017-06-14,2017,216,accountability; european union
1110.3390,Bayesian post-processor and other enhancements of Subset Simulation for estimating failure probabilities in high dimensions,2011-10-15,2011,216,reliability engineering
1910.09716,A deep active learning system for species identification and counting in camera trap images,2019-10-22,2019,216,human intelligence
1605.05537,ABC random forests for Bayesian parameter inference,2016-05-18,2016,216,genetics
1205.5611,Beyond citations: Scholars' visibility on the social Web,2012-05-25,2012,216,scopus
2011.00583,Game-Theoretic Multiagent Reinforcement Learning,2020-11-01,2020,215,psychology
1902.06122,Power Contours: Optimising Sample Size and Precision in Experimental Psychology and Human Neuroscience,2019-02-16,2019,215,psychology
cs/0604072,Complexity and Philosophy,2006-04-19,2006,215,philosophy
1703.07376,Network structure from rich but noisy data,2017-03-21,2017,215,world wide web
2203.15588,Deep multimodal fusion of image and non-image data in disease diagnosis and prognosis: a review,2022-03-25,2022,215,pathology; radiology
2105.09261,From parcel to continental scale - A first European crop type map based on Sentinel-1 and LUCAS Copernicus in-situ observations,2021-05-19,2021,215,european union
1902.04166,WideDTA: prediction of drug-target binding affinity,2019-02-04,2019,215,drug discovery
2202.00622,Datamodels: Predicting Predictions from Training Data,2022-02-01,2022,215,conceptual framework
1404.2076,Efficient Optimal Algorithm of Task Scheduling in Cloud Computing Environment,2014-03-25,2014,215,distributed computing
2111.06077,"A Survey on Hyperdimensional Computing aka Vector Symbolic Architectures, Part I: Models and Data Transformations",2021-11-11,2021,214,cognitive science; electrical engineering
2302.07459,The Capacity for Moral Self-Correction in Large Language Models,2023-02-15,2023,214,normative
2101.01524,“Brilliant AI Doctor” in Rural Clinics: Challenges in AI-Powered Clinical Decision Support System Deployment,2021-01-04,2021,214,clinical decision support system; decision support system
2103.09274,A survey of deep neural network watermarking techniques,2021-03-16,2021,214,multimedia
2201.05843,Cooperative Multiagent Deep Reinforcement Learning for Reliable Surveillance via Autonomous Multi-UAV Control,2022-01-15,2022,214,smart city
2305.12972,VanillaNet: the Power of Minimalism in Deep Learning,2023-05-22,2023,213,philosophy
1410.2805,HACC: Simulating Sky Surveys on State-of-the-Art Supercomputing Architectures,2014-10-08,2014,213,philosophy
1406.6312,Scalable Topical Phrase Mining from Text Corpora,2014-06-24,2014,213,topic modeling
2003.11040,Machine learning for quantum matter,2020-01-01,2020,213,materials science
2006.12739,Graph Prototypical Networks for Few-shot Learning on Attributed Networks,2020-06-23,2020,213,drug discovery
2303.11717,A Complete Survey on Generative AI (AIGC): Is ChatGPT from GPT-4 to GPT-5 All You Need?,2023-03-21,2023,213,creativity
2005.03227,Diagnosis of Coronavirus Disease 2019 (COVID-19) With Structured Latent Multi-View Representation Learning,2020-05-05,2020,213,coronavirus disease 2019 (covid-19)
1704.02116,CCL: Cross-modal Correlation Learning With Multigrained Fusion by Hierarchical Network,2017-04-07,2017,213,multimedia
1505.00922,Happy software developers solve problems better: psychological measurements in empirical software engineering,2014-03-11,2014,212,creativity; incentive; psychology; software engineering research
1909.07082,Towards A Rigorous Evaluation Of XAI Methods On Time Series,2019-09-16,2019,212,explainable artificial intelligence (xai)
2007.12620,A novel ensemble deep learning model for stock prediction based on stock prices and news,2020-07-23,2020,212,philosophy
1904.12765,Toward a principled Bayesian workflow in cognitive science.,2019-04-29,2019,212,cognitive science
2304.03272,The central role of density functional theory in the AI age,2023-04-06,2023,212,materials science
1905.05137,Analyzing Adversarial Attacks against Deep Learning for Intrusion Detection in IoT Networks,2019-05-13,2019,212,industry 4.0
2509.20427,Seedream 4.0: Toward Next-generation Multimodal Image Generation,2025-09-24,2025,212,creativity
1007.5391,Individualization as Driving Force of Clustering Phenomena in Humans,2010-07-30,2010,212,empirical research
2411.19666,Multimodal Whole Slide Foundation Model for Pathology,2024-11-29,2024,211,pathology
2311.05656,Combating Misinformation in the Age of LLMs: Opportunities and Challenges,2023-11-09,2023,211,stakeholder
2306.05836,Can Large Language Models Infer Causation from Correlation?,2023-06-09,2023,211,human intelligence
2405.05068,Chemistry beyond the scale of exact diagonalization on a quantum-centric supercomputer,2024-05-08,2024,211,distributed computing
0704.3759,Identifying network communities with a high resolution.,2007-04-27,2007,210,sociology
2404.15022,A review of deep learning-based information fusion techniques for multimodal medical image classification,2024-04-23,2024,210,pathology
1811.07749,"Past, present and future approaches using computer vision for animal re‐identification from camera trap data",2018-11-19,2018,210,ecology
2307.04340,Crystal structure generation with autoregressive large language modeling,2023-07-10,2023,210,materials science
1906.04588,What do citation counts measure? An updated review of studies on citations in scientific documents published between 2006 and 2018,2019-06-10,2019,210,narrative
1608.00612,Structured prediction models for RNN based sequence labeling in clinical text,2016-08-01,2016,210,narrative
1911.02541,Optimizing the Factual Correctness of a Summary: A Study of Summarizing Radiology Reports,2019-11-06,2019,210,radiology
2112.15011,Radiology Report Generation with a Learned Knowledge Base and Multi-modal Alignment,2021-12-30,2021,210,radiology
1511.08464,"Virtual world, defined from a technological perspective and applied to video games, mixed reality, and the Metaverse",2015-11-26,2015,210,distributed computing
1804.09479,"Coverage of highly-cited documents in Google Scholar, Web of Science, and Scopus: a multidisciplinary comparison",2018-04-24,2018,210,scopus
2006.00998,Toxicity Detection: Does Context Really Matter?,2020-06-01,2020,210,moderation
1309.6874,Integrating Document Clustering and Topic Modeling,2013-08-11,2013,209,topic modeling
2109.05067,The Flaws of Policies Requiring Human Oversight of Government Algorithms,2021-09-10,2021,209,accountability
1702.02223,Comparison of machine learning methods for classifying mediastinal lymph node metastasis of non-small cell lung cancer from 18F-FDG PET/CT images,2017-01-28,2017,209,pathology
2305.19591,Traffic Prediction using Artificial Intelligence: Review of Recent Advances and Emerging Opportunities,2022-12-01,2022,209,emerging technologies
2112.12068,Metaverse Shape of Your Life for Future: A bibliometric snapshot,2021-12-08,2021,208,marketing
1703.10603,Atomic Convolutional Networks for Predicting Protein-Ligand Binding Affinity,2017-03-30,2017,208,drug discovery
0812.4360,"Driven by Compression Progress: A Simple Principle Explains Essential Aspects of Subjective Beauty, Novelty, Surprise, Interestingness, Attention, Curiosity, Creativity, Art, Science, Music, Jokes",2008-12-23,2008,208,creativity
2403.11164,The Effects of Generative AI on Design Fixation and Divergent Thinking,2024-03-17,2024,208,creativity
1606.06364,Predicting Student Dropout in Higher Education,2016-06-20,2016,208,higher education
2203.14681,ObjectFormer for Image Manipulation Detection and Localization,2022-03-28,2022,208,multimedia
2104.07761,Microestimates of wealth for all low- and middle-income countries,2021-04-15,2021,208,sustainable development
1901.09269,Distributed learning with compressed gradient differences,2019-01-26,2019,208,distributed computing
1811.01765,Evaluating research: from informed peer review to bibliometrics,2011-06-01,2011,208,scopus
2103.07811,Delay-Aware and Energy-Efficient Computation Offloading in Mobile-Edge Computing Using Deep Reinforcement Learning,2021-03-13,2021,208,smart city
1711.01177,GRIM-Filter: Fast seed location filtering in DNA read mapping using processing-in-memory technologies,2017-11-02,2017,208,emerging technologies
1706.08606,Cognitive Psychology for Deep Neural Networks: A Shape Bias Case Study,2017-06-26,2017,207,cognitive psychology; psychology
0903.1072,Tolerating the community detection resolution limit with edge weighting.,2008-12-01,2008,207,world wide web
1912.10066,Methods for comparing uncertainty quantifications for material property predictions,2019-12-20,2019,207,materials science
2004.03544,PACT: Privacy-Sensitive Protocols And Mechanisms for Mobile Contact Tracing,2020-04-07,2020,207,public health
2203.11205,VinDr-Mammo: A large-scale benchmark dataset for computer-aided diagnosis in full-field digital mammography,2022-03-10,2022,207,radiology
1805.12244,Mining gold from implicit models to improve likelihood-free inference,2018-05-01,2018,207,genetics
2503.06027,Empowering Edge Intelligence: A Comprehensive Survey on On-Device AI Models,2025-03-08,2025,207,emerging technologies
2407.21772,ShieldGemma: Generative AI Content Moderation Based on Gemma,2024-07-31,2024,207,moderation
1803.10760,Unsupervised Predictive Memory in a Goal-Directed Agent,2018-03-28,2018,206,psychology
2302.12389,"Explainable AI is Dead, Long Live Explainable AI!: Hypothesis-driven Decision Support using Evaluative AI",2023-02-24,2023,206,conceptual framework; decision support system; explainable artificial intelligence (xai)
1503.00173,Signal Processing on Graphs: Causal Modeling of Unstructured Data,2015-02-28,2015,206,health care
2402.02338,NetLLM: Adapting Large Language Models for Networking,2024-02-04,2024,206,philosophy
2109.05184,MOMENTA: A Multimodal Framework for Detecting Harmful Memes and Their Targets,2021-09-11,2021,206,politics
1905.07593,"Nestedness in complex networks: Observation, emergence, and implications",2019-05-18,2019,206,ecology
1402.0567,Efficient Computation of the Shapley Value for Game-Theoretic Network Centrality,2014-02-03,2014,206,normative
1704.06127,Extension of technology acceptance model by using system usability scale to assess behavioral intention to use e-learning,2017-04-20,2017,206,stakeholder
2011.08449,Deep Reinforcement Learning and Permissioned Blockchain for Content Caching in Vehicular Edge Computing and Networks,2020-02-13,2020,206,multimedia
1804.07927,DuoRC: Towards Complex Language Understanding with Paraphrased Reading Comprehension,2018-04-01,2018,206,narrative
2302.04359,Sentiment analysis and opinion mining on educational data: A survey,2022-12-01,2022,205,pedagogy
2105.04932,One Shot Face Swapping on Megapixels,2021-05-11,2021,205,politics
2006.10671,Speech can produce jet-like transport relevant to asymptomatic spreading of virus,2020-06-18,2020,205,public health
2102.01009,Infrastructure Resilience Curves: Performance Measures and Summary Metrics,2021-01-29,2021,205,stakeholder
2001.09734,One Explanation Does Not Fit All,2020-01-27,2020,205,stakeholder
2012.07127,Accelerating high-throughput virtual screening through molecular pool-based active learning,2020-12-13,2020,205,drug discovery
2402.07456,OS-Copilot: Towards Generalist Computer Agents with Self-Improvement,2024-02-12,2024,205,multimedia
1607.01642,Cryptanalyzing an Image-Scrambling Encryption Algorithm of Pixel Bits,2016-07-06,2016,205,multimedia
2311.04076,Do LLMs Exhibit Human-like Response Biases? A Case Study in Survey Design,2023-11-07,2023,204,social psychology
2006.12358,Where Responsible AI meets Reality,2020-06-22,2020,204,accountability
1806.07633,Eco‐evolutionary feedbacks—Theoretical models and perspectives,2018-06-20,2018,204,ecology
1104.4823,The What and Where of Adding Channel Noise to the Hodgkin-Huxley Equations,2011-04-25,2011,204,computational biology
1007.2876,The Spread of Evidence-Poor Medicine via Flawed Social-Network Analysis,2010-07-16,2010,204,literacy
2304.09103,"ChatGPT: Applications, Opportunities, and Threats",2023-04-14,2023,204,creativity
2004.03399,Deep Learning on Chest X-ray Images to Detect and Evaluate Pneumonia Cases at the Era of COVID-19,2020-04-05,2020,204,coronavirus disease 2019 (covid-19)
2403.16081,"The Interplay of Learning, Analytics, and Artificial Intelligence in Education",2024-03-24,2024,204,human intelligence
1307.0252,Semi‐supervised clustering methods,2013-06-30,2013,204,genetics
